Ingredient,dollar,Calorie,protein,fat,carbs,,,,,,,,,,,,,,,,,
can wax beans,0.5,116,8,0.4,22,,,,,,,,,,,,,,,,,
tablespoon of coconut sugar,0.03,20,0,0,5,,,,,,,,,,,,,,,,,
of peeled and diced potatoes,0.5,77,2,0,17,,,,,,,,,,,,,,,,,
containers fresh shucked oysters,2.5,60,7,1,0,,,,,,,,,,,,,,,,,
ounces of sliced white mushrooms,0.08,5,0.5,0.1,0.9,,,,,,,,,,,,,,,,,
pound 93% lean ground beef,4.5,572,75,33,0,,,,,,,,,,,,,,,,,
leaves of mint,0.01,0,0,0,0,,,,,,,,,,,,,,,,,
splash of lemon-lime soda,0.05,0,0,0,0,,,,,,,,,,,,,,,,,
cup of hulled and halved strawberries,0.5,46,0.7,0.3,11,,,,,,,,,,,,,,,,,
pound of firm tofu,2,576,48,32,8,,,,,,,,,,,,,,,,,
tablespoon of creole-style seasoning,0.05,5,0,0,1,,,,,,,,,,,,,,,,,
cup of fresh udon noodles,0.5,200,7,0,40,,,,,,,,,,,,,,,,,
pound of boneless pork loin roast,5,544,44,28,0,,,,,,,,,,,,,,,,,
package garlic and herb cheese spread,2.5,200,6,16,2,,,,,,,,,,,,,,,,,
bottle chardonnay wine,10,750,0,0,5,,,,,,,,,,,,,,,,,
fluid ounces frozen limeade concentrate,1,192,0,0,48,,,,,,,,,,,,,,,,,
ounces of crumbled feta cheese,0.25,75,5,6,0,,,,,,,,,,,,,,,,,
thin slices capicola ham,0.15,15,1.5,1.3,0.3,,,,,,,,,,,,,,,,,
pounds of boneless rump roast,4.5,576,48,32,0,,,,,,,,,,,,,,,,,
ounces of good-quality chocolate,0.5,106,2,7,8,,,,,,,,,,,,,,,,,
tablespoon of sliced bread-and-butter pickles,0.05,5,0,0,1,,,,,,,,,,,,,,,,,
of nonfat cooking spray,0.01,0,0,0,0,,,,,,,,,,,,,,,,,
large of english cucumbers,1,45,2,0,11,,,,,,,,,,,,,,,,,
sticks of red licorice,0.1,25,0,0,6,,,,,,,,,,,,,,,,,
teaspoon of shaoxing rice wine,0.02,2,0,0,0,,,,,,,,,,,,,,,,,
of aluminum foil,0,0,0 .,,,,,,,,,,,,,,,,,,,
ounces of yams,0.02,25,0.3,0.1,5.9,,,,,,,,,,,,,,,,,
of center cut pork chops,2.5,209,25,11,0,,,,,,,,,,,,,,,,,
cup of pumpkin pure,0.5,83,2,0,21,,,,,,,,,,,,,,,,,
teaspoon of dried thyme,0.05,2,0.1,0.1,0.4,,,,,,,,,,,,,,,,,
cup of granola,0.5,545,8,24,68,,,,,,,,,,,,,,,,,
cans chopped tomatoes with juice,1.5,140,4,0,29,,,,,,,,,,,,,,,,,
teaspoon of chicken bouillon concentrate,0.02,5,0,0,1,,,,,,,,,,,,,,,,,
loaf of banana bread,10,2200,24,108,360,,,,,,,,,,,,,,,,,
package uncooked fideo noodles,1,480,12,8,80,,,,,,,,,,,,,,,,,
cloves of enoki mushrooms,0.1,1,0.1,0,0.2,,,,,,,,,,,,,,,,,
cup of walnut halves,0.5,185,4.3,18,4,,,,,,,,,,,,,,,,,
tablespoon of hulled hemp seeds,0.11,46,2.4,3.3,1.2,,,,,,,,,,,,,,,,,
cup of cooked sushi rice,0.25,206,4,0.4,44,,,,,,,,,,,,,,,,,
teaspoon of cornstarch,0.01,5,0,0,1,,,,,,,,,,,,,,,,,
quart of turkey broth,2,504,12,16,20,,,,,,,,,,,,,,,,,
teaspoon of smoked salt,0.03,0,0,0,0,,,,,,,,,,,,,,,,,
teaspoon of ketchup,0.01,4,0,0,1,,,,,,,,,,,,,,,,,
ounces of dried fettucine,0.1,28,0.5,0.1,5.6,,,,,,,,,,,,,,,,,
pound of japanese or other small eggplant,1.5,206,4,4,28,,,,,,,,,,,,,,,,,
cup of fresh pumpkin seeds,0.5,185,12,15,5,,,,,,,,,,,,,,,,,
of fully cooked breaded chicken fillets,0.5,140,14,8,5,,,,,,,,,,,,,,,,,
of broccoli florets,0.03,2,0.2,0.1,0.3,,,,,,,,,,,,,,,,,
pound of sliced deli ham,4,756,50,28,0,,,,,,,,,,,,,,,,,
teaspoon of finely ground black pepper,0.02,2,0,0,0.5,,,,,,,,,,,,,,,,,
pound of salami,7,1824,64,144,4,,,,,,,,,,,,,,,,,
of nori seaweed sheets,0.5,8,1,0,1,,,,,,,,,,,,,,,,,
teaspoon of chia seeds,0.02,10,0.5,0.5,1.5,,,,,,,,,,,,,,,,,
pounds of beef stew meat,4,710,75,40,0,,,,,,,,,,,,,,,,,
of mexican bolillo rolls,0.5,180,5,4,30,,,,,,,,,,,,,,,,,
of leg of lamb,6,683,75,44,0,,,,,,,,,,,,,,,,,
tablespoon of liquid smoke,0.02,0,0,0,0,,,,,,,,,,,,,,,,,
tablespoon of almond meal,0.06,28,1.5,2.5,1.5,,,,,,,,,,,,,,,,,
tablespoon of sausage drippings,0.02,36,1,4,0,,,,,,,,,,,,,,,,,
tablespoon of chopped fresh jalapeno pepper,0.05,2,0,0,0.5,,,,,,,,,,,,,,,,,
cup of diced dill pickles,0.5,5,0,0,1,,,,,,,,,,,,,,,,,
package soft tofu,2.5,120,10,5,2,,,,,,,,,,,,,,,,,
pound of beets,1,104,2.2,0.2,23.6,,,,,,,,,,,,,,,,,
teaspoon of old bay seafood seasoning,0.04,0,0,0,0,,,,,,,,,,,,,,,,,
ounces of manchego cheese,0.5,75,6,6,0,,,,,,,,,,,,,,,,,
teaspoon of stiff white decorator icing,0.01,4,0,0,1,,,,,,,,,,,,,,,,,
of dried chile de arbol pepper,0.1,8,0.2,0.2,1.8,,,,,,,,,,,,,,,,,
cup of cold,0,0,0,0,,,,,,,,,,,,,,,,,,
sheets of frozen puff pastry,0.5,200,3,13,20,,,,,,,,,,,,,,,,,
tablespoon of finely chopped fresh basil,0.05,1,0.1,0.1,0.2,,,,,,,,,,,,,,,,,
pound of cubed beef stew meat,4,624,56,40,0,,,,,,,,,,,,,,,,,
tablespoon of chopped green chile peppers,0.05,3,0.1,0.1,0.5,,,,,,,,,,,,,,,,,
teaspoon of ground cayenne,0.01,0,0,0,0,,,,,,,,,,,,,,,,,
of dried kashmiri chile peppers,0.05,5,0.1,0.1,1.2,,,,,,,,,,,,,,,,,
cup of monterey jack cheese,0.5,220,16,18,1,,,,,,,,,,,,,,,,,
packages soft ladyfingers,1,120,2,2,24,,,,,,,,,,,,,,,,,
large of white onions,0.5,64,1,0,15,,,,,,,,,,,,,,,,,
of firm apple,0.5,95,0.3,0.2,25,,,,,,,,,,,,,,,,,
cup of coconut juice,0.5,46,0.5,4.5,3.5,,,,,,,,,,,,,,,,,
cans whole tomatoes,1.5,70,2,0,16,,,,,,,,,,,,,,,,,
cup of diced pineapple,0.5,74,0.6,0.2,19.2,,,,,,,,,,,,,,,,,
cup of mascarpone cheese at room temperature,3.5,821,15,89,6,,,,,,,,,,,,,,,,,
tablespoon of cajun seasoning,0.08,5,0,0,1,,,,,,,,,,,,,,,,,
jars pasta sauce,2.5,200,5,8,20,,,,,,,,,,,,,,,,,
cup of chopped prosciutto,2.5,200,12,16,0,,,,,,,,,,,,,,,,,
teaspoon of powdered black food coloring,0.01,0,0,0,0,,,,,,,,,,,,,,,,,
cup of fresh mint leaves,0.5,2,0.1,0.1,0.3,,,,,,,,,,,,,,,,,
teaspoon of salt and pepper,0.01,0,0,0,0,,,,,,,,,,,,,,,,,
tablespoon of tamarind,0.03,5,0,0,1,,,,,,,,,,,,,,,,,
ounces of chicken broth,0.03,5,0.7,0.1,0.3,,,,,,,,,,,,,,,,,
large of unpeeled purple eggplant,1,35,1,0,8,,,,,,,,,,,,,,,,,
tablespoon of basil,0.03,1,0.1,0.1,0.2,,,,,,,,,,,,,,,,,
drops of liquid stevia,0.01,0,0,0,0,,,,,,,,,,,,,,,,,
pint of ricotta cheese,3.5,576,36,48,24,,,,,,,,,,,,,,,,,
cup of chicken or beef broth,0.5,16,1,0,1,,,,,,,,,,,,,,,,,
extra large zucchini,0.5,33,2,0.2,7.6,,,,,,,,,,,,,,,,,
tablespoon of minced fresh parsley leaves,0.03,1,0.1,0.1,0.2,,,,,,,,,,,,,,,,,
cup of freeze-dried vegetables,0.5,20,1,0,4,,,,,,,,,,,,,,,,,
cup of freshly grated pecorino romano cheese,2,454,24,36,0,,,,,,,,,,,,,,,,,
cup of fresh baby spinach,0.2,7,0.86,0.12,0.58,,,,,,,,,,,,,,,,,
cup of cubed seeded watermelon,0.5,46,0.6,0.2,11,,,,,,,,,,,,,,,,,
packets saltine crackers,0.2,70,1,1,15,,,,,,,,,,,,,,,,,
pound of thinly sliced genoa salami,4,1620,68,144,0,,,,,,,,,,,,,,,,,
cup of diced white onion,0.25,44,0.9,0.1,9.3,,,,,,,,,,,,,,,,,
teaspoon of pure peppermint extract,0.05,0,0,0,0,,,,,,,,,,,,,,,,,
can chopped green chilies,1.5,10,0,0,2,,,,,,,,,,,,,,,,,
cup of vegan shortening,0.5,864,0,96,0,,,,,,,,,,,,,,,,,
of 4 parts eggnog,0.5,126,3,4,5,,,,,,,,,,,,,,,,,
of jalapeno peppers - stemmed,0.2,4,0.2,0.1,0.9,,,,,,,,,,,,,,,,,
pinch of finely ground dried thyme,0.03,0,0,0,0,,,,,,,,,,,,,,,,,
cup of finely chopped broccoli,0.25,31,2.6,0.3,6,,,,,,,,,,,,,,,,,
package pastry for 9-inch double crust pie,2.5,1080,12,48,120,,,,,,,,,,,,,,,,,
cup of drained canned chicken,0.5,126,22,4,0,,,,,,,,,,,,,,,,,
cup of finely shredded carrot,0.25,25,0.5,0.2,5.9,,,,,,,,,,,,,,,,,
pounds of chicken drummies,517,33,28,0,,,,,,,,,,,,,,,,,,
tablespoon of raspberry vinaigrette,0.05,28,0,3,1,,,,,,,,,,,,,,,,,
can sliced pitted ripe olives,2.5,420,6,40,4,,,,,,,,,,,,,,,,,
tablespoon of coarse-ground black pepper,0.02,6,0.2,0.2,1.5,,,,,,,,,,,,,,,,,
pounds of whole milk ricotta cheese,3.5,828,48,64,24,,,,,,,,,,,,,,,,,
cup of finely chopped thai chile peppers,0.5,10,0.5,0.2,2,,,,,,,,,,,,,,,,,
medium of jalapeno peppers,0.25,4,0,0,1,,,,,,,,,,,,,,,,,
pound of fresh shrimp,7,184,24,1,0,,,,,,,,,,,,,,,,,
pinch of chili flakes,0.02,1,0,0,0,,,,,,,,,,,,,,,,,
cup of peppers,0.5,24,1,0,5,,,,,,,,,,,,,,,,,
can or bottle root beer,1,150,0,0,40,,,,,,,,,,,,,,,,,
stick of very cold unsalted butter,0.5,817,0.9,92,0.1,,,,,,,,,,,,,,,,,
of skinless,1,0,0,0,0,,,,,,,,,,,,,,,,,
cup of uncooked calrose rice,0.2,205,4.3,0.4,44.8,,,,,,,,,,,,,,,,,
cup of chopped thai basil,0.5,2,0.1,0.1,0.2,,,,,,,,,,,,,,,,,
tablespoon of red food coloring,0.05,0,0,0,0,,,,,,,,,,,,,,,,,
teaspoon of greek seasoning,0.02,3,0,0,0,,,,,,,,,,,,,,,,,
cup of uncooked bomba rice,0.5,200,4,0,44,,,,,,,,,,,,,,,,,
pound of cherries,3.5,654,8,4,136,,,,,,,,,,,,,,,,,
ounces of eggs,0.06,25,2.5,1.6,0.2,,,,,,,,,,,,,,,,,
package pasta,1,200,7,1,40,,,,,,,,,,,,,,,,,
pound fresh brandy,5,576,0,0,0,,,,,,,,,,,,,,,,,
bottle buffalo wing sauce,4,0,0,0,0,,,,,,,,,,,,,,,,,
cup of silver tequila,2,64,0,0,0,,,,,,,,,,,,,,,,,
container crumbled gorgonzola cheese,2.5,120,7,9,0,,,,,,,,,,,,,,,,,
of fresh bay leaves,0.01,0,0,0,0,,,,,,,,,,,,,,,,,
cup of tahini paste,0.5,188,6,16,6,,,,,,,,,,,,,,,,,
of 2 bay leaves,0,0,0,0,,,,,,,,,,,,,,,,,,
small of green onion,0.1,4,0.2,0.1,0.8,,,,,,,,,,,,,,,,,
of paula red apples - peeled,0.1,52,0.2,0.2,13.8,,,,,,,,,,,,,,,,,
tablespoon of shredded pepper jack cheese,0.06,21,1.5,1.5,0.5,,,,,,,,,,,,,,,,,
cup of ice water,0,0,0,0,,,,,,,,,,,,,,,,,,
pounds of prime rib roast,7.99,576,44,40,0,,,,,,,,,,,,,,,,,
of crispy tostada shells,0.2,60,1,2,10,,,,,,,,,,,,,,,,,
heads of baby bok choy,0.5,10,1,0,2,,,,,,,,,,,,,,,,,
teaspoon of reduced-sodium soy sauce,0.02,5,0.4,0.1,0.7,,,,,,,,,,,,,,,,,
slice of frozen peach,0.2,14,0.2,0.1,3.3,,,,,,,,,,,,,,,,,
teaspoon of minced shallot,0.02,2,0,0,0,,,,,,,,,,,,,,,,,
pound of ground chuck beef,3.5,708,44,48,0,,,,,,,,,,,,,,,,,
envelope active dry yeast,0.2,8,1,0,1,,,,,,,,,,,,,,,,,
cup of mushrooms,0.5,15,2,0.3,2,,,,,,,,,,,,,,,,,
cup of dried pinto beans,0.5,637,21,1,126,,,,,,,,,,,,,,,,,
package frozen soy burger-style crumbles,3,120,10,4,8,,,,,,,,,,,,,,,,,
teaspoon of baking cocoa,0.02,5,0.2,0.2,0.9,,,,,,,,,,,,,,,,,
pound of frozen raw shrimp,7,200,40,1,0,,,,,,,,,,,,,,,,,
tablespoon of queso dip,0.05,25,1,2,1,,,,,,,,,,,,,,,,,
cup of string beans,0.25,44,2,0,10,,,,,,,,,,,,,,,,,
tablespoon of raw sugar,0.02,48,0,0,12,,,,,,,,,,,,,,,,,
medium of red bell peppers,0.5,24,1,0,5,,,,,,,,,,,,,,,,,
tablespoon of light rum,0.02,24,0,0,0,,,,,,,,,,,,,,,,,
cup of vegan refried beans,0.5,120,8,1,20,,,,,,,,,,,,,,,,,
cup of chopped giardiniera,0.5,25,0,1,4,,,,,,,,,,,,,,,,,
bag semi-sweet chocolate chips,1.5,204,2,13,24,,,,,,,,,,,,,,,,,
of chopped fresh tomato,0.5,22,1,0,4,,,,,,,,,,,,,,,,,
blackberry  blackberry,0.05,5,0.2,0.1,1.2,,,,,,,,,,,,,,,,,
package frozen sliced okra,2,60,2,0,13,,,,,,,,,,,,,,,,,
bunch of lemon basil,2,0,0,0,0,,,,,,,,,,,,,,,,,
cup of granola cereal,0.5,205,4,8,28,,,,,,,,,,,,,,,,,
of zest of 2 lemons,0,0,0,0,,,,,,,,,,,,,,,,,,
slices of deli smoked turkey breast,0.25,25,4,1,0,,,,,,,,,,,,,,,,,
cup of cauliflower florets,0.5,25,2,0.3,5,,,,,,,,,,,,,,,,,
can pineapple tidbits,0.5,66,0.2,0,16.5,,,,,,,,,,,,,,,,,
cup of ground paprika,0.5,57,3,2,11,,,,,,,,,,,,,,,,,
ounces of high quality dark chocolate,0.5,155,2,9,13,,,,,,,,,,,,,,,,,
cup of crumbled goat cheese,3,168,11,12,0,,,,,,,,,,,,,,,,,
bars white chocolate,0.5,210,2,12,24,,,,,,,,,,,,,,,,,
cup of thai jasmine rice,0.25,205,4,0.4,45,,,,,,,,,,,,,,,,,
cans pinto beans,0.5,214,11,0.5,40,,,,,,,,,,,,,,,,,
cup of kikkoman panko bread crumbs,0.5,120,4,0,24,,,,,,,,,,,,,,,,,
cup of zesty italian-style salad dressing,0.5,140,0,14,3,,,,,,,,,,,,,,,,,
tablespoon of sweet rice flour,0.02,24,0.5,0.2,5.3,,,,,,,,,,,,,,,,,
cup of finely chopped fresh basil,0.5,6,0.6,0.2,0.7,,,,,,,,,,,,,,,,,
of japanese cucumbers,0.5,15,0.7,0.1,3.4,,,,,,,,,,,,,,,,,
bag fresh cranberries,3,45,0,0,11,,,,,,,,,,,,,,,,,
cup of panko,0.5,120,2,1,24,,,,,,,,,,,,,,,,,
tablespoon of fat-free sour cream,0.03,10,0.3,0,1.2,,,,,,,,,,,,,,,,,
cup of spicy nacho cheese sauce,0.5,170,5,10,10,,,,,,,,,,,,,,,,,
cup of brown rice,0.2,216,5,1.8,45,,,,,,,,,,,,,,,,,
cup of coarsely chopped fresh mushrooms,0.5,15,1,0,2,,,,,,,,,,,,,,,,,
pound of cod,4,614,92,8,0,,,,,,,,,,,,,,,,,
pound of langostino lobster,13.99,200,28,0.5,0,,,,,,,,,,,,,,,,,
of greek olives,0.5,22,0.3,2.3,0.3,,,,,,,,,,,,,,,,,
cup of chopped flat-leaf parsley,0.25,22,2,0,4,,,,,,,,,,,,,,,,,
teaspoon of kosher salt for grinding vegetables,0.01,0,0,0,0,,,,,,,,,,,,,,,,,
cup of red wine,2.5,123,0,0,3.8,,,,,,,,,,,,,,,,,
cup of peeled cooked shrimp,2,112,22,1,0,,,,,,,,,,,,,,,,,
cup of coarsely chopped walnuts,2.5,818,15,81,15,,,,,,,,,,,,,,,,,
cup of peeled and cubed butternut squash,0.5,63,1,0,14,,,,,,,,,,,,,,,,,
cup of nutritional yeast,0.5,60,8,0,6,,,,,,,,,,,,,,,,,
cup of candied red cherries,0.5,120,0.5,0,30,,,,,,,,,,,,,,,,,
cup of milk powder,0.5,486,24,24,56,,,,,,,,,,,,,,,,,
tablespoon of seeded and finely chopped chipotle in adobo,0.1,10,0.3,0.7,1.3,,,,,,,,,,,,,,,,,
cup of vanilla greek yogurt,0.5,150,12,5,17,,,,,,,,,,,,,,,,,
cup of minced red onion,0.25,44,0.9,0.1,10.2,,,,,,,,,,,,,,,,,
cup of freshly grated aged asiago cheese,3.5,112,9,7,0.5,,,,,,,,,,,,,,,,,
cup of chopped radicchio,0.5,7,0.4,0.1,1.4,,,,,,,,,,,,,,,,,
cup of mozzarella,0.5,85,7,6,0,,,,,,,,,,,,,,,,,
pounds of cubed leg of lamb meat,5,590,48,44,0,,,,,,,,,,,,,,,,,
twists of lime zest,0,0,0,0,,,,,,,,,,,,,,,,,,
of fresh sage sprigs,0.05,1,0.1,0.1,0.1,,,,,,,,,,,,,,,,,
teaspoon of asian chile paste,0.02,3,0,0,0.7,,,,,,,,,,,,,,,,,
cup of white vinegar,0.05,14,0,0,2,,,,,,,,,,,,,,,,,
tablespoon of packed shredded sweetened coconut,0.03,27,0.3,2.7,1.9,,,,,,,,,,,,,,,,,
cup of mexican crema,0.5,120,0,12,2,,,,,,,,,,,,,,,,,
cup of thin-sliced green onion,0.1,32,1,0,7,,,,,,,,,,,,,,,,,
ounce of chile paste,0.17,10,0.2,0.1,2.2,,,,,,,,,,,,,,,,,
pound of ground turkey breast,4,454,78,6,0,,,,,,,,,,,,,,,,,
cup of garlic powder,0.5,38,4.2,0.3,8.3,,,,,,,,,,,,,,,,,
of butternut squash - peeled,0.5,36,1,0,9,,,,,,,,,,,,,,,,,
package french vanilla cake mix,2,830,11,24,146,,,,,,,,,,,,,,,,,
cup of unsweetened flaked coconut,0.5,283,3,27,12,,,,,,,,,,,,,,,,,
package refrigerated beef roast au jus,5,160,16,8,2,,,,,,,,,,,,,,,,,
gallons of water,0,0,0,0,0,,,,,,,,,,,,,,,,,
cup of wheat germ,0.5,120,5,2.5,18,,,,,,,,,,,,,,,,,
tablespoon of ground coriander seed,0.06,6,0.3,0.2,1.2,,,,,,,,,,,,,,,,,
pound of italian-style chicken sausage,3.99,576,36,48,0,,,,,,,,,,,,,,,,,
bottles white wine,10,200,0,0,4,,,,,,,,,,,,,,,,,
dash of ground cinnamon,0.02,1,0.1,0.1,0.2,,,,,,,,,,,,,,,,,
cans canned butter beans,0.5,140,8,0.5,27,,,,,,,,,,,,,,,,,
package reduced-sodium taco seasoning mix,1.5,0,0,0,0,,,,,,,,,,,,,,,,,
of pepperoncini peppers,0.05,2,0,0,0.4,,,,,,,,,,,,,,,,,
cup of diced nopales,0.5,17,1,0,4,,,,,,,,,,,,,,,,,
cup of louisiana-style hot sauce,0.5,0,0,0,0,,,,,,,,,,,,,,,,,
dash of italian seasoning,0.03,0,0,0,0,,,,,,,,,,,,,,,,,
teaspoon of packed fresh basil leaves,0.03,1,0.1,0.1,0.2,,,,,,,,,,,,,,,,,
cup of steel cut oats,0.3,166,5,2.5,27,,,,,,,,,,,,,,,,,
ounces of pork rinds,0.25,80,5,7,0,,,,,,,,,,,,,,,,,
cup of queso chanco,0.5,150,8,10,6,,,,,,,,,,,,,,,,,
of dry kidney bean,0.25,110,8,0.4,20,,,,,,,,,,,,,,,,,
teaspoon of snipped fresh dill,0.02,0,0,0,0,,,,,,,,,,,,,,,,,
cup of canned petite diced tomatoes,0.5,25,1,0,5,,,,,,,,,,,,,,,,,
cup of heinz mustard,0.5,0,0,0,0,,,,,,,,,,,,,,,,,
of lemon slices,0.02,2,0,0,1,,,,,,,,,,,,,,,,,
of hamburger buns,0.5,140,5,2,25,,,,,,,,,,,,,,,,,
can frozen limeade,2.5,110,0,0,28,,,,,,,,,,,,,,,,,
cup of frozen shredded hash brown potatoes,0.5,150,2,8,20,,,,,,,,,,,,,,,,,
tablespoon of cilantro leaves,0.05,1,0.1,0,0.2,,,,,,,,,,,,,,,,,
cup of crumbled cotija cheese,0.5,120,8,9,0,,,,,,,,,,,,,,,,,
cup of nonfat dry milk powder,0.5,534,35,0.5,86,,,,,,,,,,,,,,,,,
dash of ground cumin,0.01,2,0,0,0,,,,,,,,,,,,,,,,,
cup of plain nonfat yogurt,0.5,137,11,0,21,,,,,,,,,,,,,,,,,
tub whipped cream cheese,3,800,16,80,6,,,,,,,,,,,,,,,,,
tablespoon of finely minced fresh parsley,0.02,1,0.1,0.1,0.2,,,,,,,,,,,,,,,,,
cup of assorted mushrooms,0.5,15,1,0,2,,,,,,,,,,,,,,,,,
cup of onion,0.25,64,1.7,0.1,15,,,,,,,,,,,,,,,,,
dash of asian chile pepper sauce,0.02,0,0,0,0,,,,,,,,,,,,,,,,,
tablespoon of aji amarillo chili paste,0.1,10,0,0,2,,,,,,,,,,,,,,,,,
ounces of cooked ham,0.5,105,14,5,0,,,,,,,,,,,,,,,,,
of mini-kaiser rolls,0.2,80,3,1,15,,,,,,,,,,,,,,,,,
of snow crab clusters,3.5,84,17,0.5,0,,,,,,,,,,,,,,,,,
pound of potato gnocchi,2,864,24,16,144,,,,,,,,,,,,,,,,,
cup of paneer cheese (or,0.5,143,11,9,2,,,,,,,,,,,,,,,,,
cans cannellini  beans,1,240,12,0.5,42,,,,,,,,,,,,,,,,,
cup of hulled and quartered strawberries,0.5,50,0.7,0.3,11.7,,,,,,,,,,,,,,,,,
of boneless skinless chicken breasts,2.5,165,31,4,0,,,,,,,,,,,,,,,,,
of prepared flatbread,0.5,150,4,4,25,,,,,,,,,,,,,,,,,
pound of fresh scallops,10,200,24,2,0,,,,,,,,,,,,,,,,,
can cannellini beans,1.5,240,15,1,41,,,,,,,,,,,,,,,,,
quart of low-sodium chicken broth,2,504,12,16,20,,,,,,,,,,,,,,,,,
cup of canned whole kernel corn,0.5,110,2,0,24,,,,,,,,,,,,,,,,,
can refrigerated pizza crust,3,170,7,4,25,,,,,,,,,,,,,,,,,
cup of fresh shrimp,3,84,17,1,0,,,,,,,,,,,,,,,,,
tablespoon of barbecue dry rub,0.05,10,0,0,2,,,,,,,,,,,,,,,,,
cup of chopped pitted kalamata olives,0.5,120,0.9,10.5,2.2,,,,,,,,,,,,,,,,,
tablespoon of ground beef,0.06,22,1.8,1.5,0,,,,,,,,,,,,,,,,,
bags milk chocolate candy kisses,0.75,210,2,12,28,,,,,,,,,,,,,,,,,
whole of cooked rotisserie chicken - skinned,10,590,60,30,0,,,,,,,,,,,,,,,,,
cans refrigerated buttermilk biscuit dough,1.5,810,12,32,79,,,,,,,,,,,,,,,,,
ounce of freshly grated parmigiano-reggiano cheese,0.5,107,8,7,0,,,,,,,,,,,,,,,,,
of garlic powder,0.1,24,1,0,6,,,,,,,,,,,,,,,,,
of additional multicolored sprinkles  for garnish,0,0,0,0,,,,,,,,,,,,,,,,,,
tablespoon of dried wakame  seaweed,0.06,2,0.1,0.1,0.2,,,,,,,,,,,,,,,,,
pound of boneless beef round steak,4,612,56,36,0,,,,,,,,,,,,,,,,,
pounds of st. louis-style pork ribs,3.5,576,32,40,0,,,,,,,,,,,,,,,,,
tablespoon of chopped fresh basil for garnish,0.05,1,0.1,0.1,0.2,,,,,,,,,,,,,,,,,
package shredded parmesan cheese,3.5,80,7,4,1,,,,,,,,,,,,,,,,,
cup of uncooked wild rice,0.5,170,6,0.5,37,,,,,,,,,,,,,,,,,
fillets halibut,3.5,140,22,2,0,,,,,,,,,,,,,,,,,
teaspoon of cold water,0,0,0,0,0,,,,,,,,,,,,,,,,,
teaspoon of oregano,0.02,2,0.2,0.2,0.4,,,,,,,,,,,,,,,,,
of frozen soft pretzels,0.5,110,3,0.5,22,,,,,,,,,,,,,,,,,
tablespoon of hot chile sauce,0.04,6,0,0,1,,,,,,,,,,,,,,,,,
cup of reduced-sodium tamari,0.5,80,2,0,16,,,,,,,,,,,,,,,,,
small head butter lettuce,1,10,1,0,2,,,,,,,,,,,,,,,,,
ounces of medium shrimp,0.2,28,6,0.2,0,,,,,,,,,,,,,,,,,
of smoked jalapeno sausages,1.5,200,12,16,2,,,,,,,,,,,,,,,,,
teaspoon of minced parsley,0.02,1,0.1,0.1,0.2,,,,,,,,,,,,,,,,,
cup of yellow corn,0.25,177,4.6,1.7,37.4,,,,,,,,,,,,,,,,,
teaspoon of melted white chocolate,0.06,12,0.3,0.8,1.5,,,,,,,,,,,,,,,,,
teaspoon of seasoned salt,0.01,0,0,0,0,,,,,,,,,,,,,,,,,
large of fresh mushrooms,0.5,5,1,0,1,,,,,,,,,,,,,,,,,
cup of sourdough starter discard,0,0,0,0,0,,,,,,,,,,,,,,,,,
cup of white lily enriched bleached self-rising flour or white lily enriched unbleached self-rising flour,0.25,468,10,0,97,,,,,,,,,,,,,,,,,
,,,,,,,,,,,,,,,,,,,,,,
1 cup white lily enriched unbleached self-rising flour,0.25,468,10,0,97,,,,,,,,,,,,,,,,,
slices of bacon,0.06,43,2,3,0,,,,,,,,,,,,,,,,,
pound of napa cabbage,1,44,2,0,9,,,,,,,,,,,,,,,,,
tablespoon of brown roux,0.05,16,0.2,1.4,1.2,,,,,,,,,,,,,,,,,
fluid ounces soda water,0,0,0,0,,,,,,,,,,,,,,,,,,
ounces of ground sirloin,1.5,224,20,16,0,,,,,,,,,,,,,,,,,
pounds of extra-lean ground beef,3.5,576,48,32,0,,,,,,,,,,,,,,,,,
tub philadelphia savoury garlic cooking creme,3.99,790,12,72,24,,,,,,,,,,,,,,,,,
tablespoon of sea salt,0.02,0,0,0,0,,,,,,,,,,,,,,,,,
cans eagle brand sweetened condensed milk,2.5,860,16,24,96,,,,,,,,,,,,,,,,,
jar capers,3,10,0,0,2,,,,,,,,,,,,,,,,,
jar pimento-stuffed green olives,3.5,160,0,15,2,,,,,,,,,,,,,,,,,
teaspoon of fresh dill,0.05,1,0,0,0,,,,,,,,,,,,,,,,,
large of avocado,1,322,4,29,17,,,,,,,,,,,,,,,,,
tablespoon of good quality balsamic vinegar,0.1,14,0,0,2,,,,,,,,,,,,,,,,,
bottle lager beer,2,153,0,0,13,,,,,,,,,,,,,,,,,
cup of leftover cubed corned beef,0.5,218,17,15,0,,,,,,,,,,,,,,,,,
pound of thin-sliced bacon,3.5,1824,56,144,0,,,,,,,,,,,,,,,,,
pound of thinly sliced mesquite smoked turkey breast,5,468,55,5,0,,,,,,,,,,,,,,,,,
slices italian bread,0.1,70,2,1,13,,,,,,,,,,,,,,,,,
tablespoon of minced habanero pepper,0.05,2,0,0,0,,,,,,,,,,,,,,,,,
can diced tomatoes with green chile peppers,2.5,40,1,0,9,,,,,,,,,,,,,,,,,
cup of finely shredded cheddar cheese,0.5,115,7,9,0,,,,,,,,,,,,,,,,,
cup of carbonated water,0,0,0,0,0,,,,,,,,,,,,,,,,,
loaves italian bread,3,576,24,8,96,,,,,,,,,,,,,,,,,
of ube,0.5,80,0.5,0.5,19,,,,,,,,,,,,,,,,,
pound of sirloin tips,4.99,810,88,36,0,,,,,,,,,,,,,,,,,
cup of buffalo wing sauce,0.5,120,0,0,28,,,,,,,,,,,,,,,,,
cup of wilted spinach,0.25,7,0.86,0.11,1.09,,,,,,,,,,,,,,,,,
cup of untoasted walnut halves,0.5,185,4.3,18,4,,,,,,,,,,,,,,,,,
tablespoon of finely grated fresh ginger,0.06,4,0.1,0,1,,,,,,,,,,,,,,,,,
package chicken-flavored seitan,3.99,180,20,0,5,,,,,,,,,,,,,,,,,
package frozen cut asparagus,2.5,30,2,0,5,,,,,,,,,,,,,,,,,
thin slice red onion,0.03,4,0,0,1,,,,,,,,,,,,,,,,,
cup of kraft shredded pepper jack cheese with a touch of philadelphia,1.5,110,8,8,0,,,,,,,,,,,,,,,,,
cup of mashed ripe banana,0.5,105,1.3,0.4,27,,,,,,,,,,,,,,,,,
cup of rapeseed oil,0.5,884,0,100,0,,,,,,,,,,,,,,,,,
jar alfredo sauce,4,1080,24,96,64,,,,,,,,,,,,,,,,,
can fully cooked luncheon meat,2.5,320,17,18,2,,,,,,,,,,,,,,,,,
teaspoon of confectioners' sugar,0.01,16,0,0,4,,,,,,,,,,,,,,,,,
cup of 2% milk,0.5,122,8,5,12,,,,,,,,,,,,,,,,,
ounces of herb and garlic-flavored cream cheese,0.5,80,2,8,1,,,,,,,,,,,,,,,,,
teaspoon of chopped fresh cilantro,0.02,1,0,0,0,,,,,,,,,,,,,,,,,
tablespoon of melted shortening,0.06,45,0,5,0,,,,,,,,,,,,,,,,,
cup of chopped oil-cured olives,0.5,119,0.9,11.5,2.7,,,,,,,,,,,,,,,,,
cup of chopped fresh figs,0.5,74,1,0,19,,,,,,,,,,,,,,,,,
quarts of hot water,0,0,0,0,0,,,,,,,,,,,,,,,,,
slices of pastrami,0.5,80,6,3,0,,,,,,,,,,,,,,,,,
package potato gnocchi,2,500,12,1,98,,,,,,,,,,,,,,,,,
teaspoon of vinegar-based hot pepper sauce,0.01,0,0,0,0,,,,,,,,,,,,,,,,,
cup of high-protein bread flour,0.5,464,17,1,92,,,,,,,,,,,,,,,,,
pound of fresh buffalo mozzarella cheese,6,828,56,64,0,,,,,,,,,,,,,,,,,
large of boneless chicken breast halves,2,110,24,2,0,,,,,,,,,,,,,,,,,
tablespoon of tamari,0.03,10,0.5,0.3,0.7,,,,,,,,,,,,,,,,,
teaspoon of bottled minced garlic,0.05,4,0.2,0,0.9,,,,,,,,,,,,,,,,,
medium of yellow bell pepper,0.5,24,1,0,5,,,,,,,,,,,,,,,,,
teaspoon of roasted red pepper and garlic seasoning blend,0.03,2,0,0,0.5,,,,,,,,,,,,,,,,,
pounds of beef short ribs,4,590,41,40,0,,,,,,,,,,,,,,,,,
cup of fresh lima beans,0.5,210,13.2,0.4,40.4,,,,,,,,,,,,,,,,,
fluid ounce orange flavored liqueur,0.5,97,0,0,10,,,,,,,,,,,,,,,,,
cup of low sodium soy sauce,0.5,,0,0,8,,,,,,,,,,,,,,,,,
pound of russet potatoes,0.5,220,4.6,0.2,50.2,,,,,,,,,,,,,,,,,
cup of hot pepper sauce,0.5,0,0,0,0,,,,,,,,,,,,,,,,,
cup of quick oats,0.25,166,5,2.5,28,,,,,,,,,,,,,,,,,
tablespoon of chopped and toasted macadamia nuts,0.25,45,1,4.5,1,,,,,,,,,,,,,,,,,
tablespoon of coarse ground black pepper,0.03,6,0.2,0.1,1.5,,,,,,,,,,,,,,,,,
package mccormick guacamole seasoning mix,1.19,0,0,0,0,,,,,,,,,,,,,,,,,
cup of dry marsala wine,2.5,126,0,0,0,,,,,,,,,,,,,,,,,
of 3 cup  large flake quaker oats,1.5,540,18,9,108,,,,,,,,,,,,,,,,,
cup of mango nectar,0.5,131,0.4,0.2,33.2,,,,,,,,,,,,,,,,,
tablespoon of almond flour,0.06,28,1.3,2.5,1.6,,,,,,,,,,,,,,,,,
36 of ground black pepper,0,0,0,0,,,,,,,,,,,,,,,,,,
cup of fancy molasses,0.5,602,0.8,0,152,,,,,,,,,,,,,,,,,
tablespoon of coarse kosher salt,0.02,0,0,0,0,,,,,,,,,,,,,,,,,
pounds of lean ground pork,3,744,44,64,0,,,,,,,,,,,,,,,,,
pounds of broccoli florets,2,112,8,0.4,24,,,,,,,,,,,,,,,,,
cup of chopped potatoes,0.2,114,2,0,26,,,,,,,,,,,,,,,,,
tortillas whole-wheat tortillas,0.2,80,4,1.5,15,,,,,,,,,,,,,,,,,
cup of seedless raspberry jam,0.5,200,0,0,51,,,,,,,,,,,,,,,,,
box chicken-flavored crackers,2,480,12,16,60,,,,,,,,,,,,,,,,,
package mezze  penne pasta,2.5,500,12,2,90,,,,,,,,,,,,,,,,,
cup of cold unsweetened almond milk,0.5,40,1,2.5,1,,,,,,,,,,,,,,,,,
cup of white rice flour,0.5,600,12,1,132,,,,,,,,,,,,,,,,,
ounces of chopped onion,0.03,7,0.2,0.1,1.4,,,,,,,,,,,,,,,,,
teaspoon of castor sugar or superfine sugar,0.01,16,0,0,4,,,,,,,,,,,,,,,,,
packages butter-flavored puffed corn,0.5,120,1,4,24,,,,,,,,,,,,,,,,,
teaspoon of ground cumin,0.02,5,0.3,0.2,0.8,,,,,,,,,,,,,,,,,
pound of sliced cooked chicken breast,4,454,50,9,0,,,,,,,,,,,,,,,,,
pinch of garlic salt and pepper to taste,0,0,0,0,,,,,,,,,,,,,,,,,,
ounces of cheese curds,0.25,50,2,3,0,,,,,,,,,,,,,,,,,
cup of low-fat eggnog,0.5,149,6,4,19,,,,,,,,,,,,,,,,,
tablespoon of sun-dried tomato paste,0.05,10,0.5,0.5,2,,,,,,,,,,,,,,,,,
container raspberries,3.99,64,1.5,0.6,14.7,,,,,,,,,,,,,,,,,
slice of fresh lemon,0.1,4,0.2,0.2,1.5,,,,,,,,,,,,,,,,,
packet of chicken noodle soup mix,1,80,3,1,15,,,,,,,,,,,,,,,,,
cup of crushed pretzels,0.5,110,2,2,22,,,,,,,,,,,,,,,,,
of seasoned butter,1,100,0,11,0,,,,,,,,,,,,,,,,,
tablespoon of finely chopped cilantro,0.05,1,0,0,0,,,,,,,,,,,,,,,,,
tablespoon of coriander powder,0.03,4,0.2,0.1,0.8,,,,,,,,,,,,,,,,,
cup of tomato sauce or marinara sauce,0.5,86,2,2,17,,,,,,,,,,,,,,,,,
ounces of fresh cheese-filled tortellini,0.5,220,10,10,30,,,,,,,,,,,,,,,,,
of ripe tomato,0,0,0.2,0.2,3.9,,,,,,,,,,,,,,,,,
teaspoon of all-purpose flour for dusting*,0.01,4,0.1,0.1,0.9,,,,,,,,,,,,,,,,,
tablespoon of raw peanuts,0.04,49,1.5,4.5,1.5,,,,,,,,,,,,,,,,,
teaspoon of spicy seasoned salt,0.02,0,0,0,0,,,,,,,,,,,,,,,,,
pounds of new red potatoes,1,590,11,0,135,,,,,,,,,,,,,,,,,
ounces of low-fat cottage cheese,0.08,21,2,0.5,1,,,,,,,,,,,,,,,,,
tablespoon of chopped fresh parsley for garnish,0.05,1,0.1,0.1,0.2,,,,,,,,,,,,,,,,,
cup of peeled and chopped apples,0.5,57,0.3,0.2,14.5,,,,,,,,,,,,,,,,,
teaspoon of crushed dried oregano,0.02,2,0,0,0.5,,,,,,,,,,,,,,,,,
cup of whole or chopped walnuts,0.5,185,4.3,18.3,4.3,,,,,,,,,,,,,,,,,
pound of pie crust pastry,2,864,12,32,96,,,,,,,,,,,,,,,,,
thin slices swiss cheese,0.1,42,2.5,3,0.3,,,,,,,,,,,,,,,,,
ounces of philadelphia neufchatel cheese,0.25,50,2,4,1,,,,,,,,,,,,,,,,,
teaspoon of liquid smoke,0.02,0,0,0,0,,,,,,,,,,,,,,,,,
tablespoon of flaked coconut,0.05,57,0.5,5.3,2.3,,,,,,,,,,,,,,,,,
teaspoon of meat tenderizer,0.02,0,0,0,0,,,,,,,,,,,,,,,,,
teaspoon of red curry paste,0.05,5,0,0,1,,,,,,,,,,,,,,,,,
