Ingredient,dollar,Calorie,protein,fat,carbs,,,,,,,,,,,,,,,,,
of picked over turkey carcass,0,0,0,0,,,,,,,,,,,,,,,,,,
can campbell's condensed creamy poblano & queso soup,2.5,200,8,8,19,,,,,,,,,,,,,,,,,
teaspoon of food coloring,0.01,0,0,0,0,,,,,,,,,,,,,,,,,
pounds of paneer,4.5,544,36,40,0,,,,,,,,,,,,,,,,,
teaspoon of browning sauce,0.02,0,0,0,0,,,,,,,,,,,,,,,,,
jar peanut butter,3,1520,48,144,32,,,,,,,,,,,,,,,,,
package thinly sliced deli ham,3,80,11,1,1,,,,,,,,,,,,,,,,,
large of dill pickle,0.5,5,0,0,1,,,,,,,,,,,,,,,,,
cup of fresh or frozen broccoli flowerets,0.5,31,2.6,0.3,6.6,,,,,,,,,,,,,,,,,
cup of ragu old world style traditional pasta sauce,0.5,80,2,4,10,,,,,,,,,,,,,,,,,
cup of diced fresh ginger,0.5,18,0.8,0.2,4.2,,,,,,,,,,,,,,,,,
tablespoon of finely chopped garlic,0.04,4,0.2,0,0.9,,,,,,,,,,,,,,,,,
cup of cooked garbanzo beans,0.5,164,9,3,27,,,,,,,,,,,,,,,,,
of pork sirloin roast,1.5,170,22,8,0,,,,,,,,,,,,,,,,,
teaspoon of spice islands garlic powder,0.05,6,0,0,1,,,,,,,,,,,,,,,,,
tablespoon of coconut cream,0.08,40,0,4.5,0,,,,,,,,,,,,,,,,,
teaspoon of crushed red pepper flakes,0.02,4,0,0,1,,,,,,,,,,,,,,,,,
bunch of fresh dill,0.5,4,0.3,0.1,0.6,,,,,,,,,,,,,,,,,
of canned chipotle pepper in adobo sauce,0.5,10,0,0,2,,,,,,,,,,,,,,,,,
gallons of cool water,0.5,0,0,0,0,,,,,,,,,,,,,,,,,
teaspoon of cool water,0,0,0,0,0,,,,,,,,,,,,,,,,,
large of boneless,0,0,0,0,,,,,,,,,,,,,,,,,,
package instant chocolate pudding mix,0.5,100,2,2,19,,,,,,,,,,,,,,,,,
pound of andouille or smoked sausage,4.5,864,36,72,0,,,,,,,,,,,,,,,,,
can pizza sauce,0.5,35,1,1,7,,,,,,,,,,,,,,,,,
cup of soft brown sugar,0.5,774,0,0,198,,,,,,,,,,,,,,,,,
teaspoon of lemon zest,0.01,0,0,0,0,,,,,,,,,,,,,,,,,
cup of frozen french fries,0.5,220,3,11,28,,,,,,,,,,,,,,,,,
tablespoon of finely chopped celery,0.02,2,0.1,0.1,0.3,,,,,,,,,,,,,,,,,
tablespoon of wine vinegar,0.03,0,0,0,0,,,,,,,,,,,,,,,,,
tablespoon of dried italian herb seasoning,0.05,5,0,0,1,,,,,,,,,,,,,,,,,
package egg noodles,1,200,7,1,40,,,,,,,,,,,,,,,,,
of unbaked pastry shell,1.5,563,9,33,62,,,,,,,,,,,,,,,,,
of blue crabs,3,84,16,1,0,,,,,,,,,,,,,,,,,
pinch of salt,0.01,0,0,0,0,,,,,,,,,,,,,,,,,
of chinese eggplants,0.5,24,1,0,6,,,,,,,,,,,,,,,,,
cup of crispy chow mein noodles,0.5,160,2,8,22,,,,,,,,,,,,,,,,,
of sugar pumpkin,0.5,49,1,0,12,,,,,,,,,,,,,,,,,
cup of chopped cucumber,0.1,16,0.5,0.1,3.6,,,,,,,,,,,,,,,,,
cup of raw walnut halves,0.5,185,4.3,18,4,,,,,,,,,,,,,,,,,
cup of mexican-style sour cream,0.5,120,2,10,2,,,,,,,,,,,,,,,,,
of white mushrooms,0.25,5,0.5,0,1.2,,,,,,,,,,,,,,,,,
pounds of whole-milk ricotta cheese,3,828,48,72,28,,,,,,,,,,,,,,,,,
medium of fresh tomatoes - cored,0.25,22,1,0,5,,,,,,,,,,,,,,,,,
tablespoon of fresh squeezed orange juice,0.06,8,0,0,2,,,,,,,,,,,,,,,,,
stalk of celery,0.2,6,0.5,0,1.6,,,,,,,,,,,,,,,,,
pound of canadian bacon,4,744,56,48,0,,,,,,,,,,,,,,,,,
cup of fresh broccoli florets,0.25,31,2.6,0.4,6.6,,,,,,,,,,,,,,,,,
large of jicama,1,100,1,0,25,,,,,,,,,,,,,,,,,
quart of vegetable oil for deep-frying,7,1944,0,224,0,,,,,,,,,,,,,,,,,
large of fresh strawberries,0.25,7,0.3,0.2,1.6,,,,,,,,,,,,,,,,,
of portobello mushroom cap,0.5,24,2,0.2,4,,,,,,,,,,,,,,,,,
pounds of boneless beef round steak,5,576,44,38,0,,,,,,,,,,,,,,,,,
tablespoon of pyure organic all purpose stevia blend,0.1,0,0,0,0,,,,,,,,,,,,,,,,,
large of yam,0.5,177,2.6,0.1,41.4,,,,,,,,,,,,,,,,,
pound of fresh beets,2,140,3,0,33,,,,,,,,,,,,,,,,,
cup of shredded medium cheddar cheese,0.5,115,7,9,0.4,,,,,,,,,,,,,,,,,
small of heirloom tomatoes,0.5,8,0.5,0.2,1.6,,,,,,,,,,,,,,,,,
package round dumpling skins,2,120,5,0,25,,,,,,,,,,,,,,,,,
of raspberries,0.5,64,1.5,0.6,14.7,,,,,,,,,,,,,,,,,
slice of bread,0.1,69,3,1,13,,,,,,,,,,,,,,,,,
of sweet-tart apple,0.5,95,0.3,0.2,25,,,,,,,,,,,,,,,,,
teaspoon of finely chopped fresh ginger,0.03,2,0.1,0.1,0.5,,,,,,,,,,,,,,,,,
tablespoon of clarified butter,0.1,102,0,12,0,,,,,,,,,,,,,,,,,
cup of cooked egg noodles,0.5,200,7,1,37,,,,,,,,,,,,,,,,,
teaspoon of tamarind concentrate,0.02,0,0,0,0,,,,,,,,,,,,,,,,,
package farmers cheese,2.5,150,8,8,0,,,,,,,,,,,,,,,,,
cup of long-grain rice,0.2,205,4.3,0.4,45,,,,,,,,,,,,,,,,,
cup of dry hot wheat cereal,0.5,150,4,0.5,33,,,,,,,,,,,,,,,,,
of chopped parsley,0.25,22,2,0,4,,,,,,,,,,,,,,,,,
tablespoon of caraway seed,0.1,12,0.5,0.5,1.5,,,,,,,,,,,,,,,,,
can hormel mary kitchen roast beef hash,2.99,140,8,7,6,,,,,,,,,,,,,,,,,
package of taco seasoning mix,0.5,20,0,0,5,,,,,,,,,,,,,,,,,
cans whole cranberry sauce,2.5,130,0,0,33,,,,,,,,,,,,,,,,,
cup of unsweetened apple juice,0.5,114,0,0,28,,,,,,,,,,,,,,,,,
cup of chopped dried apricots,0.5,165,2,0,41,,,,,,,,,,,,,,,,,
package cornbread mix,2,540,8,12,94,,,,,,,,,,,,,,,,,
teaspoon of finely minced fresh ginger root,0.02,2,0,0,0.5,,,,,,,,,,,,,,,,,
package finely chopped lettuce,2,10,1,0,2,,,,,,,,,,,,,,,,,
cup of bacon drippings,0.5,817,0,92,0,,,,,,,,,,,,,,,,,
tablespoon of finely shredded romano cheese,0.06,21,1.5,1.5,0.2,,,,,,,,,,,,,,,,,
teaspoon of chopped pimento-stuffed green olives,0.04,5,0,0.5,0.5,,,,,,,,,,,,,,,,,
tablespoon of chopped fresh dill weed,0.05,1,0,0,0,,,,,,,,,,,,,,,,,
packages refrigerated crescent rolls,2.5,270,8,16,28,,,,,,,,,,,,,,,,,
cup of finely chopped spinach,0.25,7,0.86,0.12,1.09,,,,,,,,,,,,,,,,,
pound of chopped fully cooked ham,3,810,56,44,0,,,,,,,,,,,,,,,,,
ounces of diced ham,0.2,28,3,1,0,,,,,,,,,,,,,,,,,
pounds of large russet potatoes,1,576,16,0,136,,,,,,,,,,,,,,,,,
cup of low-fat,0.5,102,8,2,12,,,,,,,,,,,,,,,,,
teaspoon of coarse colored sugar,0.02,16,0,0,4,,,,,,,,,,,,,,,,,
teaspoon of finely chopped red onion,0.01,2,0,0,0.4,,,,,,,,,,,,,,,,,
ounces of sharp provolone cheese,0.2,106,6,8,0 carbs,,,,,,,,,,,,,,,,,
ounces of freshly-squeezed lemon juice,0.1,2,0,0,1,,,,,,,,,,,,,,,,,
heads of fresh broccoli,1,45,4,0.4,9,,,,,,,,,,,,,,,,,
cup of lemonade,0,0,0,0,24,,,,,,,,,,,,,,,,,
tablespoon of duck fat,0.12,45,0,5,0,,,,,,,,,,,,,,,,,
teaspoon of chile-garlic sauce,0.05,5,0,0,1,,,,,,,,,,,,,,,,,
cup of creme fraiche,0.5,205,2,21,3,,,,,,,,,,,,,,,,,
bar semisweet chocolate,0.5,137,2,9,12,,,,,,,,,,,,,,,,,
package low-sodium gravy mix,1,35,0,0,8,,,,,,,,,,,,,,,,,
ounces of mozzarella cheese,0.25,28,4,2,0,,,,,,,,,,,,,,,,,
cup of milled flax seeds,0.5,150,5,8,8,,,,,,,,,,,,,,,,,
cup of mini candy-coated chocolate pieces,0.5,200,2,10,33,,,,,,,,,,,,,,,,,
cup of red zinfandel wine,3.5,125,0,0,3.8,,,,,,,,,,,,,,,,,
cup of bacon,0.5,548,16,44,0,,,,,,,,,,,,,,,,,
medium head cabbage,0.5,77,5,0,17,,,,,,,,,,,,,,,,,
cup of ramps leaves,0.5,17,1,0,3,,,,,,,,,,,,,,,,,
pound of chopped cooked shrimp meat,7,192,36,1,0,,,,,,,,,,,,,,,,,
of prepared pie shell,2.5,825,6,40,80,,,,,,,,,,,,,,,,,
tablespoon of spicy horseradish,0.05,0,0,0,0,,,,,,,,,,,,,,,,,
cup of crushed cookies,0.5,471,5,20,71,,,,,,,,,,,,,,,,,
package chicken tenders,5,600,30,20,0,,,,,,,,,,,,,,,,,
jiggers tequila,0.5,64,0,0,0,,,,,,,,,,,,,,,,,
cup of fresh cherries,0.5,77,1.1,0.3,19,,,,,,,,,,,,,,,,,
of deep-dish frozen pie crusts,2.5,880,10,44,86,,,,,,,,,,,,,,,,,
ounces of chopped fresh mushrooms,0.14,5,0.5,0.1,0.8,,,,,,,,,,,,,,,,,
cup of chopped fresh broccoli,0.25,31,2.6,0.4,6,,,,,,,,,,,,,,,,,
cans white beans,1,400,20,0,70,,,,,,,,,,,,,,,,,
pounds of ground chuck or 80% lean ground beef,3.5,816,57,64,0,,,,,,,,,,,,,,,,,
jars alfredo-style pasta sauce,3,860,10,48,64,,,,,,,,,,,,,,,,,
cup of mashed cooked sweet potatoes,0.5,114,2,0,27,,,,,,,,,,,,,,,,,
pounds of ground chicken breast,4,454,44,15,0,,,,,,,,,,,,,,,,,
pounds of pork picnic roast,3.5,590,58,36,0,,,,,,,,,,,,,,,,,
tablespoon of cure,0.05,0,0,0,0,,,,,,,,,,,,,,,,,
cup of finely chopped mild green chiles,0.5,6,0.3,0.1,1.3,,,,,,,,,,,,,,,,,
slices of manchego cheese,0.5,85,6,7,0,,,,,,,,,,,,,,,,,
cup of blanched almonds,1.5,828,21,74,20,,,,,,,,,,,,,,,,,
of egg yolks,0.1,55,6,5,0.4,,,,,,,,,,,,,,,,,
teaspoon of dried italian herbs,0.02,2,0,0,0,,,,,,,,,,,,,,,,,
cup of soy milk,0.5,80,7,4,4,,,,,,,,,,,,,,,,,
cup of egg substitute,0.5,25,4,0,0,,,,,,,,,,,,,,,,,
cup of mashed banana,0.5,105,1.3,0.4,27,,,,,,,,,,,,,,,,,
tablespoon of mixed berries,0.05,6,0.1,0.1,1.3,,,,,,,,,,,,,,,,,
of sweet italian sausage links,0.5,80,5,6,0,,,,,,,,,,,,,,,,,
cup of stir-fry sauce,0.5,80,0,0,19,,,,,,,,,,,,,,,,,
cup of whole wheat couscous,0.5,176,6,1,36,,,,,,,,,,,,,,,,,
cup of sliced zucchini,0.25,17,1,0.2,3,,,,,,,,,,,,,,,,,
of small red hot chile peppers,0.1,2,0.1,0.1,0.4,,,,,,,,,,,,,,,,,
packages smoked sausage,3.5,270,14,22,2,,,,,,,,,,,,,,,,,
cup of plain yogurt,0.5,149,11,4,12,,,,,,,,,,,,,,,,,
teaspoon of sour cream,0.02,10,0.5,1,0.3,,,,,,,,,,,,,,,,,
tablespoon of kecap manis,0.03,15,0,0,4,,,,,,,,,,,,,,,,,
pods of green cardamom,0.05,0,0,0,0,,,,,,,,,,,,,,,,,
of prime rib roast,10,518,43,34,0,,,,,,,,,,,,,,,,,
teaspoon of snipped fresh chives,0.02,0,0,0,0,,,,,,,,,,,,,,,,,
cup of bite-size corn square cereal,0.5,120,2,0.5,28,,,,,,,,,,,,,,,,,
packages restaurant-style tortilla chips,1.5,480,8,24,56,,,,,,,,,,,,,,,,,
tablespoon of maple syrup,0.08,52,0,0,14,,,,,,,,,,,,,,,,,
small of banana slices,0.25,72,1,0,19,,,,,,,,,,,,,,,,,
of coarse kosher salt,0,0,0,0,,,,,,,,,,,,,,,,,,
cup of shredded aged cheddar cheese,0.5,115,7,9,0,,,,,,,,,,,,,,,,,
wedges of fresh lemon,0.05,4,0,0,1,,,,,,,,,,,,,,,,,
pinch of ground thyme,0.02,0,0,0,0,,,,,,,,,,,,,,,,,
drops of food coloring,0,0,0,,,,,,,,,,,,,,,,,,,
tablespoon of unsweetened dutch-process cocoa powder,0.05,12,1,0.5,3,,,,,,,,,,,,,,,,,
of egg at room temperature,0.17,72,6,5,0,,,,,,,,,,,,,,,,,
teaspoon of chopped fresh chives for garnish,0.03,1,0,0,0,,,,,,,,,,,,,,,,,
cup of colored decorating sugar,0.5,400,0,0,100,,,,,,,,,,,,,,,,,
package lasagna noodles,2,740,24,16,144,,,,,,,,,,,,,,,,,
package reduced-fat cream cheese,2.5,80,5,5,1,,,,,,,,,,,,,,,,,
cup of 151 proof rum,0.5,672,0,0,0,,,,,,,,,,,,,,,,,
of hanger steaks,7.5,170,25,8,0,,,,,,,,,,,,,,,,,
head of green leaf lettuce,1.5,25,2,0,5,,,,,,,,,,,,,,,,,
containers whipped topping,2,80,0,8,5,,,,,,,,,,,,,,,,,
cup of thick plain yogurt,0.5,149,11,8,8,,,,,,,,,,,,,,,,,
cup of ice,0,0,0,0,0,,,,,,,,,,,,,,,,,
can pumpkin puree,0.5,83,3,0,21,,,,,,,,,,,,,,,,,
of jalapeno,0.25,4,0.3,0.1,0.8,,,,,,,,,,,,,,,,,
pound of beef eye of round sliced into.25 inch strips,4,522,56,20,0,,,,,,,,,,,,,,,,,
of 3 tablespoon reserved beef fat from beef birria recipe,,270,0,30,0,,,,,,,,,,,,,,,,,
cup of oats,0.2,307,5.9,6.9,28.1,,,,,,,,,,,,,,,,,
tablespoon of skim milk,0.03,8,0.8,0.1,0.8,,,,,,,,,,,,,,,,,
small of egg,0.1,72,6,5,0.4,,,,,,,,,,,,,,,,,
can no-salt-added sweet corn,1.99,120,3,0,27,,,,,,,,,,,,,,,,,
large of yams,0.5,180,4,0,42,,,,,,,,,,,,,,,,,
pound of purple potatoes,1,576,16,0,136,,,,,,,,,,,,,,,,,
bag chocolate chips,3.99,690,11,36,79,,,,,,,,,,,,,,,,,
cup of creamy salad dressing,0.5,200,0,20,5,,,,,,,,,,,,,,,,,
pound of beef top sirloin,6.99,576,56,28,0,,,,,,,,,,,,,,,,,
pound of fresh white mushrooms,2,45,4,0,9,,,,,,,,,,,,,,,,,
teaspoon of buffalo wing sauce,0.02,5,0,0,1,,,,,,,,,,,,,,,,,
tablespoon of dried chives,0.05,2,0,0,0.4,,,,,,,,,,,,,,,,,
cup of rock sugar,0.5,380,0,0,97,,,,,,,,,,,,,,,,,
tablespoon of thinly sliced green onion,0.02,2,0.1,0.1,0.3,,,,,,,,,,,,,,,,,
pounds of whole chicken,3.5,454,28,28,0,,,,,,,,,,,,,,,,,
dash of celery salt,0.02,0,0,0,0,,,,,,,,,,,,,,,,,
tablespoon of chili-garlic sauce,0.03,10,0,0,2,,,,,,,,,,,,,,,,,
can green bell peppers,0.5,24,1,0,6,,,,,,,,,,,,,,,,,
cup of queso blanco dip,0.5,145,5,11,4,,,,,,,,,,,,,,,,,
tablespoon of onion,0.02,4,0.1,0,0.9,,,,,,,,,,,,,,,,,
can sliced water chestnuts,1.5,60,1,0,14,,,,,,,,,,,,,,,,,
dashes of hot sauce,0,0,0,,,,,,,,,,,,,,,,,,,
cans frozen lemonade concentrate,1.5,140,0,0,36,,,,,,,,,,,,,,,,,
cup of frozen lima beans,0.5,115,7.3,0.4,22.8,,,,,,,,,,,,,,,,,
ounces of fresh mozzarella cheese,0.27,28,3,2,0,,,,,,,,,,,,,,,,,
teaspoon of creme fraiche,0.04,8,0.3,0.8,0.4,,,,,,,,,,,,,,,,,
cup of medium salsa,0.5,20,0,0,5,,,,,,,,,,,,,,,,,
cup of low-sodium broth,0.5,10,0,0,2,,,,,,,,,,,,,,,,,
sprig of fresh mint,0.03,0,0,0,0,,,,,,,,,,,,,,,,,
teaspoon of garlic base,0.02,4,0.2,0.1,0.9,,,,,,,,,,,,,,,,,
package unflavored gelatin,0.5,25,5,0,0,,,,,,,,,,,,,,,,,
of bone-in prime rib,8,478,42,34,0,,,,,,,,,,,,,,,,,
cup of finely crushed saltine cracker crumbs,0.25,120,2,3,21,,,,,,,,,,,,,,,,,
cup of finely chopped red bell pepper,0.5,24,0.5,0.2,5.3,,,,,,,,,,,,,,,,,
small head bok choy,0.5,11,1.2,0.2,2.2,,,,,,,,,,,,,,,,,
of vine tomatoes,0.5,22,1,0,5,,,,,,,,,,,,,,,,,
cup of bulgur wheat,0.5,151,5,0,33,,,,,,,,,,,,,,,,,
tablespoon of fresh cilantro,0.04,0,0,0,0,,,,,,,,,,,,,,,,,
packages rigatoni,1.5,200,8,1,40,,,,,,,,,,,,,,,,,
of tortilla chips,0.25,140,2,8,15,,,,,,,,,,,,,,,,,
package frozen steak fries,2.5,500,6,20,70,,,,,,,,,,,,,,,,,
cup of drained mandarin oranges,0.5,83,1,0,21,,,,,,,,,,,,,,,,,
of kiwi fruit,0.5,42,1,0,10,,,,,,,,,,,,,,,,,
tablespoon of chicken bouillon powder,0.05,10,0.5,0,1,,,,,,,,,,,,,,,,,
ounces of shredded part-skim,0.06,28,2,1,0,,,,,,,,,,,,,,,,,
medium of tomatoes - peeled,0.5,22,1,0,5,,,,,,,,,,,,,,,,,
ounces of rice vermicelli,0.25,200,7,0,43,,,,,,,,,,,,,,,,,
of avocado - peeled,1.5,322,4,29,17,,,,,,,,,,,,,,,,,
pounds of shredded cooked chicken meat,4,544,24,16,0,,,,,,,,,,,,,,,,,
of small celery stalk,0.05,4,0.3,0,1,,,,,,,,,,,,,,,,,
cup of matchstick-cut seeded cucumber,0.25,16,0.6,0.1,3.4,,,,,,,,,,,,,,,,,
pound of brazil nuts,11.99,828,28,76,16,,,,,,,,,,,,,,,,,
cup of coarsely chopped red onion,0.2,44,0.8,0.1,10,,,,,,,,,,,,,,,,,
pint of cherry tomatoes,2,80,4,0,16,,,,,,,,,,,,,,,,,
tablespoon of torn fresh cilantro leaves,0.05,0,0,0,0,,,,,,,,,,,,,,,,,
can chunk light tuna,0.99,140,25,1,0,,,,,,,,,,,,,,,,,
large of pineapple - peeled,2.5,132,0.5,0.2,33.4,,,,,,,,,,,,,,,,,
cup of canned jalapeno pepper slices,0.5,5,0,0,1,,,,,,,,,,,,,,,,,
of navel orange,0.5,69,2,0,17,,,,,,,,,,,,,,,,,
cup of plain yogurt or sour cream,0.5,145,8,10,6,,,,,,,,,,,,,,,,,
pounds of chicken legs and thighs,2.5,576,36,32,0,,,,,,,,,,,,,,,,,
pounds of medium shrimp - peeled and deveined,7.5,360,72,0.9,0,,,,,,,,,,,,,,,,,
teaspoon freshly ground black pork tenderloins,0.1,3,0.3,0.1,0.2,,,,,,,,,,,,,,,,,
cup of no-salt-added chicken broth,0,0,0,0,,,,,,,,,,,,,,,,,,
of assorted,,,,,,,,,,,,,,,,,,,,,,
pounds of salmon fillet,10,454,48,25,0,,,,,,,,,,,,,,,,,
pound chicken,3.5,454,41,16,0,,,,,,,,,,,,,,,,,
pounds of bacon,4,1664,56,144,0,,,,,,,,,,,,,,,,,
teaspoon of hungarian paprika,0.02,4,0.2,0.1,0.9,,,,,,,,,,,,,,,,,
cup of grape jelly,0.5,206,0,0,52,,,,,,,,,,,,,,,,,
tablespoon of apricot jam,0.04,24,0,0,6,,,,,,,,,,,,,,,,,
pounds of beef eye of round roast,4,516,41,22,0,,,,,,,,,,,,,,,,,
cup of peeled and minced carrots,0.25,52,1,0,12,,,,,,,,,,,,,,,,,
cup of confectioners' sugar for dusting,0.5,774,0,0,198,,,,,,,,,,,,,,,,,
container alfredo-style pasta sauce,3.5,500,8,16,40,,,,,,,,,,,,,,,,,
pounds of bone-in,2,454,33,25,0,,,,,,,,,,,,,,,,,
of sea salt and coarsely ground pepper to taste,0,0,0,0,,,,,,,,,,,,,,,,,,
pound of apples - peeled,1.5,110,1,0,29,,,,,,,,,,,,,,,,,
cup of hot chicken broth,0,0,2,0,,,,,,,,,,,,,,,,,,
tablespoon of chicken stock,0.03,5,0.5,0.1,0.1,,,,,,,,,,,,,,,,,
package tempeh,2.5,190,15,8,9,,,,,,,,,,,,,,,,,
cup of kraft grated parmesan cheese,1.5,110,10,4,1,,,,,,,,,,,,,,,,,
cup of beef gravy,0.5,80,2,4,6,,,,,,,,,,,,,,,,,
cup of blue cheese,0.5,100,6,8,1,,,,,,,,,,,,,,,,,
cup of spiced rum,0.5,213,0,0,0,,,,,,,,,,,,,,,,,
of fresh pineapple,2,82,0.5,0.2,21.6,,,,,,,,,,,,,,,,,
tablespoon of red miso,0.05,10,0.5,0.5,1,,,,,,,,,,,,,,,,,
tablespoon of black truffle-infused olive oil,1,40,0,4.5,0,,,,,,,,,,,,,,,,,
tablespoon of parsley,0.03,1,0.1,0.1,0.2,,,,,,,,,,,,,,,,,
tablespoon of chipotle pepper in adobo sauce,0.08,10,0.3,0.4,1.2,,,,,,,,,,,,,,,,,
tablespoon of mustard,0.02,3,0,0,0,,,,,,,,,,,,,,,,,
teaspoon of saffron powder,0.5,0,0,0,0,,,,,,,,,,,,,,,,,
small heads savoy cabbage,0.5,25,2,0,5,,,,,,,,,,,,,,,,,
bunch of gai lan,2,30,2,0,6,,,,,,,,,,,,,,,,,
sprig of chopped fresh dill,0.1,1,0.1,0.1,0.2,,,,,,,,,,,,,,,,,
cup of clamato tomato cocktail,0.5,25,0,0,6,,,,,,,,,,,,,,,,,
of pitted and chopped medjool dates,0.25,66,0.3,0.1,18,,,,,,,,,,,,,,,,,
of land o lakes eggs,0.17,70,6,5,0,,,,,,,,,,,,,,,,,
cup of chopped green chile pepper,0.5,15,0.9,0.2,3.3,,,,,,,,,,,,,,,,,
of frozen banana,0.25,105,1,0,27,,,,,,,,,,,,,,,,,
of red chile peppers,0.5,6,0.5,0.2,1.3,,,,,,,,,,,,,,,,,
bottle dry white wine,10,750,0,0,5,,,,,,,,,,,,,,,,,
cup of cucumber slices,0.2,16,0.5,0,3.5,,,,,,,,,,,,,,,,,
cup of firmly packed light brown sugar,0.5,774,0,0,198,,,,,,,,,,,,,,,,,
teaspoon of chile powder,0.02,4,0,0,1,,,,,,,,,,,,,,,,,
pinch of creole seasoning,0.05,0,0,0,0,,,,,,,,,,,,,,,,,
of 2 parts tomato juice,0.5,24,1,0,5,,,,,,,,,,,,,,,,,
of heads cauliflower,2.5,177,5,1,10,,,,,,,,,,,,,,,,,
container frozen nondairy low-fat whipped topping,2,80,0,0,0,,,,,,,,,,,,,,,,,
ounces of 70% bittersweet chocolate,0.5,70,1.4,4.5,5.4,,,,,,,,,,,,,,,,,
teaspoon of orange extract,0.02,0,0,0,0,,,,,,,,,,,,,,,,,
cup of shallots,0.5,28,0.5,0.1,6.4,,,,,,,,,,,,,,,,,
slices of lime,0.02,1,0,0,0,,,,,,,,,,,,,,,,,
can whole potatoes,0.25,110,2.3,0.1,25.3,,,,,,,,,,,,,,,,,
ounces of uncooked white rice,0.03,28,0.6,0.1,6,,,,,,,,,,,,,,,,,
slice of mozzarella cheese,0.25,72,5,4.5,0.5,,,,,,,,,,,,,,,,,
cup of chanterelle mushrooms,2.5,25,2,0,4,,,,,,,,,,,,,,,,,
packages instant vanilla pudding mix,0.5,80,2,0,18,,,,,,,,,,,,,,,,,
cans sweetened condensed milk,2,825,14,24,105,,,,,,,,,,,,,,,,,
ounces of macaroni,0.06,25,0.5,0.1,5,,,,,,,,,,,,,,,,,
teaspoon of shichimi togarashi,0.02,2,0,0,0,,,,,,,,,,,,,,,,,
teaspoon of crushed peppercorns,0.01,2,0,0,0.4,,,,,,,,,,,,,,,,,
cup of tofu,0.5,94,10,4,2,,,,,,,,,,,,,,,,,
sprigs of cilantro leaves,0.05,1,0.1,0,0.2,,,,,,,,,,,,,,,,,
teaspoon of apple pie spice or ground cinnamon,0.02,2,0,0,0.5,,,,,,,,,,,,,,,,,
tablespoon of vanilla-flavored almond milk,0.03,8,0.2,0.3,0.5,,,,,,,,,,,,,,,,,
dashes of hot pepper sauce,0,0,0,0,,,,,,,,,,,,,,,,,,
tablespoon of chopped fresh basil,0.03,1,0,0,0,,,,,,,,,,,,,,,,,
teaspoon of butter,0.02,36,0,4,0,,,,,,,,,,,,,,,,,
large of vegan tortillas,0.5,90,2,2,17,,,,,,,,,,,,,,,,,
cup of coarsely chopped toasted pecans,0.5,204,3,20,4,,,,,,,,,,,,,,,,,
slices of texas toast thick-sliced bread,0.06,80,2,2,12,,,,,,,,,,,,,,,,,
tablespoon of instant white rice,0.02,16,0.3,0.1,3.3,,,,,,,,,,,,,,,,,
cup of cajun seasoning,0.5,0,0,0,0,,,,,,,,,,,,,,,,,
cup of unbleached bread flour,0.5,455,11,1,96,,,,,,,,,,,,,,,,,
package shredded colby jack cheese,2.5,400,20,24,2,,,,,,,,,,,,,,,,,
of soy sauce to taste,0,0,0,0,,,,,,,,,,,,,,,,,,
gallons of cold water,0.5,0,0,0,0,,,,,,,,,,,,,,,,,
ounces of beef filet,4,208,24,11,0,,,,,,,,,,,,,,,,,
cup of mixed salad greens such as leaf lettuce,0.25,7,0.5,0.2,1.2,,,,,,,,,,,,,,,,,
cup of prune juice or water,0.5,130,0,0,33,,,,,,,,,,,,,,,,,
teaspoon of sea salt,0.01,0,0,0,0,,,,,,,,,,,,,,,,,
tablespoon of semolina flour,0.03,24,0.5,0.2,5,,,,,,,,,,,,,,,,,
cup of pitted dates,0.5,282,2.5,0.4,74,,,,,,,,,,,,,,,,,
package cubed tofu,2,200,20,10,4,,,,,,,,,,,,,,,,,
teaspoon of crushed chili flakes,0.02,2,0.1,0.1,0.5,,,,,,,,,,,,,,,,,
sprigs of fresh parsley,0.05,1,0.1,0.1,0.2,,,,,,,,,,,,,,,,,
pound of bulk pork breakfast sausage,3,864,48,72,0,,,,,,,,,,,,,,,,,
cup of chicken bone broth,0.5,25,2,0,0,,,,,,,,,,,,,,,,,
cup of low-sodium chicken broth,0.5,8,0.5,0,1,,,,,,,,,,,,,,,,,
cup of chopped dark chocolate,2,607,8,42,47,,,,,,,,,,,,,,,,,
small of zucchini,0.25,17,1,0,4,,,,,,,,,,,,,,,,,
teaspoon of purple food coloring,0.02,0,0,0,0,,,,,,,,,,,,,,,,,
cup of cooked bacon,0.5,517,20,41,0,,,,,,,,,,,,,,,,,
tablespoon of smoked salt,0.03,0,0,0,0,,,,,,,,,,,,,,,,,
ounces of tito's handmade vodka,0.5,64,0,0,0,,,,,,,,,,,,,,,,,
teaspoon of aleppo chili flakes,0.05,2,0,0,0,,,,,,,,,,,,,,,,,
teaspoon of sweet relish,0.03,4,0,0,1,,,,,,,,,,,,,,,,,
teaspoon of salsa,0.02,2,0,0,0,,,,,,,,,,,,,,,,,
package pastry for a 9-inch double-crust pie,2.5,2160,16,96,192,,,,,,,,,,,,,,,,,
cup of quick-cooking grits,0.25,177,5,0,38,,,,,,,,,,,,,,,,,
envelope unflavored gelatin,0.2,25,5,0,0,,,,,,,,,,,,,,,,,
pound of part-skim ricotta cheese,3,518,32,32,16,,,,,,,,,,,,,,,,,
cup of all-purpose apples,0.5,57,0.3,0.2,14.4,,,,,,,,,,,,,,,,,
teaspoon of blackened seasoning,0.03,5,0,0,1,,,,,,,,,,,,,,,,,
large of bananas,0.25,121,1.3,0.4,30,,,,,,,,,,,,,,,,,
of star anise pod,0.1,5,0.1,0.1,1.3,,,,,,,,,,,,,,,,,
of fuji apples,0.5,95,0.3,0.2,25,,,,,,,,,,,,,,,,,
teaspoon of goya ground cumin,0.05,5,0.3,0.3,0.9,,,,,,,,,,,,,,,,,
slices bread,0.1,69,3,1,12,,,,,,,,,,,,,,,,,
tablespoon of rum,0.05,12,0,0,0,,,,,,,,,,,,,,,,,
jigger sweetened lime juice,0.25,25,0,0,6,,,,,,,,,,,,,,,,,
can whole peeled tomatoes in juice,1.5,70,2,0,15,,,,,,,,,,,,,,,,,
cup of raspberry jam,0.5,200,0,0,51,,,,,,,,,,,,,,,,,
large head lettuce,1.5,24,2,0,5,,,,,,,,,,,,,,,,,
cup of chinese rice wine,2,40,0,0,0,,,,,,,,,,,,,,,,,
quart of hot vegetable stock,2,504,12,16,20,,,,,,,,,,,,,,,,,
tablespoon of chopped fresh flat-leaf parsley,0.05,1,0.1,0.1,0.2,,,,,,,,,,,,,,,,,
a pinch of cayenne,0.01,0,0,0,0,,,,,,,,,,,,,,,,,
teaspoon of freshly grated orange peel,0.01,0,0,0,0,,,,,,,,,,,,,,,,,
ounces of brown mushrooms,0.05,5,0.5,0.1,0.7,,,,,,,,,,,,,,,,,
cup of shredded pepperjack cheese,0.5,116,8,8,0,,,,,,,,,,,,,,,,,
cans dark red kidney beans,1,240,13,0,40,,,,,,,,,,,,,,,,,
cup of plain dried breadcrumbs,0.5,115,4,0.5,21,,,,,,,,,,,,,,,,,
carton nonfat sour cream,2.5,80,2,0,4,,,,,,,,,,,,,,,,,
tablespoon of thai green curry paste,0.1,10,0.2,0.9,1.2,,,,,,,,,,,,,,,,,
package mushrooms,2,20,2,0,4,,,,,,,,,,,,,,,,,
package lowfat cream cheese,2,400,10,20,5,,,,,,,,,,,,,,,,,
cans peeled and diced tomatoes with juice,1.5,130,4,0,28,,,,,,,,,,,,,,,,,
teaspoon of mccormick cinnamon,0.02,2,0,0,0.5,,,,,,,,,,,,,,,,,
tablespoon of minced fresh rosemary,0.04,1,0.1,0.1,0.1,,,,,,,,,,,,,,,,,
tablespoon of freshly grated parmesan cheese,0.08,22,2,1.5,0.5,,,,,,,,,,,,,,,,,
medium ear corn,0.5,77,4,1,17,,,,,,,,,,,,,,,,,
cup of water at room temperature,0,0,0,0,0,,,,,,,,,,,,,,,,,
cup of miniature chocolate chips,0.5,204,2,12,25,,,,,,,,,,,,,,,,,
cup of pearl barley,0.5,193,4.5,0.5,41,,,,,,,,,,,,,,,,,
pounds of beef sirloin roast,5,664,44,44,0,,,,,,,,,,,,,,,,,
envelope ranch salad dressing mix,0.5,10,0,0,2,,,,,,,,,,,,,,,,,
of cayenne pepper,0.03,6,0.3,0.3,1.2,,,,,,,,,,,,,,,,,
cup of maraschino cherries,0.5,80,0,0,20,,,,,,,,,,,,,,,,,
cup of corn flour,0.2,576,24,4,120,,,,,,,,,,,,,,,,,
cup of strong coffee,0,0,0,0,,,,,,,,,,,,,,,,,,
of fresh pasta sheets,0.1,35,2,0,7,,,,,,,,,,,,,,,,,
pounds of fresh mozzarella cheese,4.99,792,56,64,0,,,,,,,,,,,,,,,,,
cup of garlic croutons,0.5,120,2,4,20,,,,,,,,,,,,,,,,,
of pear - peeled,0.5,81,0.5,0.2,21,,,,,,,,,,,,,,,,,
cup of sliced italian sausage,0.5,545,25,43,1,,,,,,,,,,,,,,,,,
pounds of flank steak,5.99,612,56,36,0,,,,,,,,,,,,,,,,,
package dried lima beans,2,860,36,2,152,,,,,,,,,,,,,,,,,
quart of grape juice,3,544,12,0,144,,,,,,,,,,,,,,,,,
large of russet potatoes,0.5,161,4,0,37,,,,,,,,,,,,,,,,,
pinch of kosher salt for rimming glasses,0.01,0,0,0,0,,,,,,,,,,,,,,,,,
slices fresh pineapple,0.5,50,0.5,0.2,13,,,,,,,,,,,,,,,,,
tablespoon of fresh basil,0.04,1,0.1,0.1,0.2,,,,,,,,,,,,,,,,,
teaspoon of plus.5 tsp. black pepper,0.02,2,0,0,0.4,,,,,,,,,,,,,,,,,
container dairy sour cream,2.5,400,8,35,4,,,,,,,,,,,,,,,,,
teaspoon of almond extract,0.05,1,0,0,0,,,,,,,,,,,,,,,,,
tablespoon of pickling spice,0.02,2,0,0,0,,,,,,,,,,,,,,,,,
package garden herb tofu,3.99,200,10,10,4,,,,,,,,,,,,,,,,,
large head bok choy,2,20,2,0,4,,,,,,,,,,,,,,,,,
cup of reserved chicken broth,0,0,0,0,,,,,,,,,,,,,,,,,,
can whole pitted black olives,2,80,0.8,7,2,,,,,,,,,,,,,,,,,
cup of shredded fat-free cheddar cheese,0.5,112,14,0.5,2,,,,,,,,,,,,,,,,,
cup of picante sauce,0.5,20,0,0,5,,,,,,,,,,,,,,,,,
cup of cold coffee,0,0,0,0,,,,,,,,,,,,,,,,,,
of long seedless cucumber,0.5,16,0.7,0.1,3.6,,,,,,,,,,,,,,,,,
cartons chicken broth,2.5,60,2,1,5,,,,,,,,,,,,,,,,,
package ready-to-use refrigerated pie crust,2.5,880,12,48,80,,,,,,,,,,,,,,,,,
of oranges - juiced and zest cut off in large strips,0.5,62,1,0,15,,,,,,,,,,,,,,,,,
of cooked,126,126,24,4,0,,,,,,,,,,,,,,,,,
ounces of pineapple juice,0.5,86,0.3,0.1,22,,,,,,,,,,,,,,,,,
teaspoon of pickling spice,0.02,2,0,0,0,,,,,,,,,,,,,,,,,
pound of cubed fully cooked ham,3.5,572,42,36,0,,,,,,,,,,,,,,,,,
cup of idahoan hash browns,0.5,150,2,9,20,,,,,,,,,,,,,,,,,
container small curd cottage cheese,1.5,80,14,2,3,,,,,,,,,,,,,,,,,
teaspoon of coarse sea salt or kosher salt,0.01,0,0,0,0,,,,,,,,,,,,,,,,,
teaspoon of fine sea salt,0.01,0,0,0,0,,,,,,,,,,,,,,,,,
cup of shredded reduced-fat cheddar cheese,0.5,114,12,6,0,,,,,,,,,,,,,,,,,
cup of coarsely chopped fresh cilantro,0.5,2,0.1,0.1,0.3,,,,,,,,,,,,,,,,,
cup of kalamata olives,0.5,160,1,15,3,,,,,,,,,,,,,,,,,
cup of sparkling wine,4,120,0,0,3,,,,,,,,,,,,,,,,,
jigger silver tequila,0.5,97,0,0,0,,,,,,,,,,,,,,,,,
slices of fresh lemon,0.05,3,0.1,0.1,1.3,,,,,,,,,,,,,,,,,
ounces of guanciale,0.5,69,3,6,0,,,,,,,,,,,,,,,,,
ounces of orzo pasta,0.06,54,1.5,0.2,10.5,,,,,,,,,,,,,,,,,
packet fajita seasoning,0.5,30,0,0,7,,,,,,,,,,,,,,,,,
cup of vital wheat gluten,0.5,75,25,0,12,,,,,,,,,,,,,,,,,
pound of dried corona beans,1,1545,97,4,272,,,,,,,,,,,,,,,,,
ounces of high quality dark chocolate,0.5,155,2,10,14,,,,,,,,,,,,,,,,,
ounces of chourico sausage,0.25,75,4,6,0,,,,,,,,,,,,,,,,,
teaspoon of grey sea salt,0.01,0,0,0,0,,,,,,,,,,,,,,,,,
small of potato,0.1,77,2,0,17,,,,,,,,,,,,,,,,,
teaspoon of sriracha chile sauce,0.02,5,0,0,1,,,,,,,,,,,,,,,,,
pound of bone-in pork chops,4,516,56,32,0,,,,,,,,,,,,,,,,,
tablespoon of torn fresh basil leaves,0.05,1,0.1,0.1,0.2,,,,,,,,,,,,,,,,,
of portobello mushrooms,0.5,22,2,0,4,,,,,,,,,,,,,,,,,
teaspoon of fish sauce,0.02,5,0.2,0.1,0.3,,,,,,,,,,,,,,,,,
of basil leaves,0.02,1,0.1,0.1,0.2,,,,,,,,,,,,,,,,,
cans olive oil-packed tuna,2,200,24,12,0,,,,,,,,,,,,,,,,,
can light cherry pie filling,2.5,140,0,0,36,,,,,,,,,,,,,,,,,
tablespoon of sliced black olives,0.03,5,0.2,0.5,0.5,,,,,,,,,,,,,,,,,
fillets fresh sea bass,4,121,24,2,0,,,,,,,,,,,,,,,,,
tubes refrigerated crescent roll dough,2,810,10,40,80,,,,,,,,,,,,,,,,,
packages sliced baby portobello mushrooms,2.5,40,4,0,8,,,,,,,,,,,,,,,,,
