Ingredient,dollar,Calorie,protein,fat,carbs,,,,,,,,,,,,,,,,,
tablespoon of strawberry flavored jell-o,0.03,11,0,0,2,,,,,,,,,,,,,,,,,
large of salt and ground black pepper to taste,0,0,0,0,,,,,,,,,,,,,,,,,,
pound of tilapia,4,208,36,4,0,,,,,,,,,,,,,,,,,
quart of rum,20,816,0,0,0,,,,,,,,,,,,,,,,,
cup of canned roma tomatoes,0.5,42,1.3,0.4,8.9,,,,,,,,,,,,,,,,,
slices of asiago cheese,0.2,45,4,3,0,,,,,,,,,,,,,,,,,
pounds of sliced ham,4,586,42,41,0,,,,,,,,,,,,,,,,,
cup of sesame oil,0.5,240,0,27,0,,,,,,,,,,,,,,,,,
cup of herb stuffing mix,0.5,160,4,8,24,,,,,,,,,,,,,,,,,
teaspoon of minced fresh flat-leaf parsley,0.03,0,0,0,0,,,,,,,,,,,,,,,,,
cup of hot cooked brown rice,0.25,216,4.5,1.8,44,,,,,,,,,,,,,,,,,
cup of dried porcini mushrooms,2.99,60,5,0.5,10,,,,,,,,,,,,,,,,,
of chicken breasts,2.5,165,31,4,0,,,,,,,,,,,,,,,,,
slices of oatnut bread,0.25,80,2,2,12,,,,,,,,,,,,,,,,,
cup of sliced cantaloupe,0.5,34,1,0,8,,,,,,,,,,,,,,,,,
cup of mayonnaise,0.5,821,0,92,0,,,,,,,,,,,,,,,,,
of coarse ground black pepper to taste,0,0,0,,,,,,,,,,,,,,,,,,,
cup of shredded monterey jack cheese,0.5,200,14,14,0,,,,,,,,,,,,,,,,,
of mini croissants,0.25,80,2,4,8,,,,,,,,,,,,,,,,,
cup of chopped red maraschino cherries,0.5,74,0.4,0.2,18.2,,,,,,,,,,,,,,,,,
ounces of dates,0.15,23,0.3,0.2,6,,,,,,,,,,,,,,,,,
of cube steaks,3.5,240,24,12,0,,,,,,,,,,,,,,,,,
cup of berry-flavored schnapps,0.5,126,0,0,15,,,,,,,,,,,,,,,,,
tablespoon of banana liqueur,0.04,11,0,0,2,,,,,,,,,,,,,,,,,
pound of whole carrots,0.5,140,2,0.2,33,,,,,,,,,,,,,,,,,
of freshly grated parmesan cheese for serving,0.2,20,2,1,0,,,,,,,,,,,,,,,,,
recipe of pastry for a  double crust pie,,,,,,,,,,,,,,,,,,,,,,
2 cups all-purpose flour,0.5,800,18,24,96,,,,,,,,,,,,,,,,,
ounces of shiitake mushrooms,0.17,5,0.4,0.1,0.9,,,,,,,,,,,,,,,,,
pounds of beef back ribs,4.5,790,59,61,0,,,,,,,,,,,,,,,,,
cup of whole-milk ricotta cheese,0.5,337,20,20,8,,,,,,,,,,,,,,,,,
slice of american cheese,0.2,113,6,8,0,,,,,,,,,,,,,,,,,
package hawaiian bread rolls,0.5,120,3,2,24,,,,,,,,,,,,,,,,,
tablespoon of seville orange marmalade,0.05,25,0,0,6,,,,,,,,,,,,,,,,,
cup of corn flakes,0.25,109,1,0,24,,,,,,,,,,,,,,,,,
teaspoon of curry powder,0.03,4,0,0,1,,,,,,,,,,,,,,,,,
cup of whole fat plain greek yogurt,0.5,150,17,9,5,,,,,,,,,,,,,,,,,
squares bittersweet chocolate,0.1,43,1,2,5,,,,,,,,,,,,,,,,,
of marrons glaces,2.5,200,0,11,24,,,,,,,,,,,,,,,,,
of dried shiitake mushrooms,0.2,4,0.3,0.1,0.7,,,,,,,,,,,,,,,,,
cup of chocolate-covered toffee bits,0.5,472,3,25,59,,,,,,,,,,,,,,,,,
cup of dry red cooking wine,0.5,24,0,0,0,,,,,,,,,,,,,,,,,
teaspoon of browning sauce,0.02,8,0,0,2,,,,,,,,,,,,,,,,,
can baby corn,0.1,4,0.2,0.1,0.8,,,,,,,,,,,,,,,,,
teaspoon of cayenne pepper hot sauce,0.02,2,0,0,0,,,,,,,,,,,,,,,,,
pounds of lean beef,4.5,728,56,28,0,,,,,,,,,,,,,,,,,
cup of diced fresh peaches,0.5,58,1,0,14,,,,,,,,,,,,,,,,,
small of beets,0.25,37,1,0,8,,,,,,,,,,,,,,,,,
bottles lemon-lime carbonated beverage,1,140,0,0,37,,,,,,,,,,,,,,,,,
ounces of dried linguine,0.14,200,7,1,40,,,,,,,,,,,,,,,,,
teaspoon of freshly grated gingerroot,0.02,2,0,0,0.5,,,,,,,,,,,,,,,,,
cup of diced fresh mushrooms,0.5,15,1.5,0.3,1.5,,,,,,,,,,,,,,,,,
package medium pasta shells,1,200,7,1,40,,,,,,,,,,,,,,,,,
of fresh lime,0,0,0,2.4,,,,,,,,,,,,,,,,,,
cup of frozen shelled edamame,0.5,133,11,4,10,,,,,,,,,,,,,,,,,
of 1 clove pomander,0,0,0,0,,,,,,,,,,,,,,,,,,
cup of chopped baby spinach leaves,0.25,7,1,0,1,,,,,,,,,,,,,,,,,
cup of grated fresh ginger root,0.5,8,0.8,0.1,1.8,,,,,,,,,,,,,,,,,
slices day-old italian bread,0.2,75,2,1,13,,,,,,,,,,,,,,,,,
ounces of dry fettuccini pasta,0.06,28,1.3,0.2,5.7,,,,,,,,,,,,,,,,,
pinch of mexican-style chili powder with lime,0.02,0,0,0,0,,,,,,,,,,,,,,,,,
package white almond bark,2.5,860,10,60,60,,,,,,,,,,,,,,,,,
tablespoon of lemon pepper seasoning,0.03,5,0,0,1,,,,,,,,,,,,,,,,,
of lime wedges,0.1,4,0,0,1,,,,,,,,,,,,,,,,,
ounces of frozen medium shrimp - thawed,1.5,80,16,0.5,0,,,,,,,,,,,,,,,,,
of green cardamom pods,0.02,0,0,0,0,,,,,,,,,,,,,,,,,
cup of quartered artichoke hearts in water,0.5,25,1.5,0.2,4.5,,,,,,,,,,,,,,,,,
ounce of stevia powder,0.2,0,0,0,0,,,,,,,,,,,,,,,,,
of dried oregano,0.05,2,0.2,0.2,0.4,,,,,,,,,,,,,,,,,
package cinnamon roll dough with glaze,2.5,830,13,28,105,,,,,,,,,,,,,,,,,
can condensed chicken broth,2.5,80,8,1,4,,,,,,,,,,,,,,,,,
ounces of cauliflower,0.03,5,0.3,0.1,1,,,,,,,,,,,,,,,,,
cup of corn oil for frying,0.5,1920,0,216,0,,,,,,,,,,,,,,,,,
tablespoon of pineapple juice concentrate,0.03,13,0,0,3,,,,,,,,,,,,,,,,,
cup of sweetened,0.5,200,0,0,50,,,,,,,,,,,,,,,,,
pounds of pork shoulder roast,3,590,55,40,0,,,,,,,,,,,,,,,,,
package frozen sliced strawberries,2.5,150,2,0,36,,,,,,,,,,,,,,,,,
tablespoon of chopped pickles,0.03,2,0,0,0,,,,,,,,,,,,,,,,,
of note,0.5,0,0,0,0,,,,,,,,,,,,,,,,,
cup of 100% pure pumpkin,0.5,30,1,0,7,,,,,,,,,,,,,,,,,
cup of wide egg noodles,0.5,200,7,1,40,,,,,,,,,,,,,,,,,
cup of sliced green bell pepper,0.25,24,1,0,5,,,,,,,,,,,,,,,,,
tablespoon of pumpkin syrup,0.06,21,0,0,5,,,,,,,,,,,,,,,,,
cup of crispy corn cereal squares,0.5,110,1,0.5,24,,,,,,,,,,,,,,,,,
of celery,0.2,6,0.6,0,1.6,,,,,,,,,,,,,,,,,
cup of diced carrot,0.25,25,0.6,0.1,6,,,,,,,,,,,,,,,,,
can diced tomatoes with juice,1.5,90,4,0,19,,,,,,,,,,,,,,,,,
tablespoon of kikkoman soy sauce,0.04,8,0.5,0,1.5,,,,,,,,,,,,,,,,,
cup of chia seeds,2.5,138,4.4,8.6,12.3,,,,,,,,,,,,,,,,,
medium of zucchini,0.5,33,2,0.3,7,,,,,,,,,,,,,,,,,
teaspoon of citric acid powder,0.02,0,0,0,0,,,,,,,,,,,,,,,,,
packages frozen cheese-filled blintzes,2.5,300,10,15,30,,,,,,,,,,,,,,,,,
package baker's white chocolate,3,810,6,49,64,,,,,,,,,,,,,,,,,
teaspoon of chocolate-hazelnut spread,0.02,25,0.5,1.5,3,,,,,,,,,,,,,,,,,
fluid ounce grenadine syrup,0.08,25,0,0,7,,,,,,,,,,,,,,,,,
fluid ounces triple sec,0.2,65,0,0,8,,,,,,,,,,,,,,,,,
cup of cranberry-grape juice,0.5,120,0,0,30,,,,,,,,,,,,,,,,,
teaspoon of vital wheat gluten,0.02,4,1,0,0,,,,,,,,,,,,,,,,,
of cilantro leaves,0.1,1,0.1,0,0.2,,,,,,,,,,,,,,,,,
tablespoon of finely chopped sun-dried tomatoes,0.13,10,0.3,0.2,1.7,,,,,,,,,,,,,,,,,
package nacho cheese-flavored tortilla chips,0.25,150,2,8,16,,,,,,,,,,,,,,,,,
cup of cream or milk,0.5,204,2,20,4,,,,,,,,,,,,,,,,,
scoops of vanilla ice cream,0.5,90,2,5,10,,,,,,,,,,,,,,,,,
cup of red bell pepper,0.5,24,1,0,5,,,,,,,,,,,,,,,,,
teaspoon of hot paprika,0.08,5,0.3,0.2,1.1,,,,,,,,,,,,,,,,,
bag egg noodles,1.5,500,12,6,90,,,,,,,,,,,,,,,,,
tablespoon of white truffle oil,1.5,45,0,5,0,,,,,,,,,,,,,,,,,
tablespoon of crushed peanuts,0.05,54,2,5,1,,,,,,,,,,,,,,,,,
strip of nori seaweed,0.05,5,0.5,0.1,0.9,,,,,,,,,,,,,,,,,
can organic beef broth,2.5,40,2,0,1,,,,,,,,,,,,,,,,,
cup of short-grain white rice,0.2,205,4,0.4,45,,,,,,,,,,,,,,,,,
large of plum tomatoes,0.5,22,1,0,5,,,,,,,,,,,,,,,,,
of uncooked prepared beef,0.5,126,10,6,0,,,,,,,,,,,,,,,,,
of miniature multi-colored sweet peppers,0.5,10,0.4,0.2,2.3,,,,,,,,,,,,,,,,,
cans mexican-style hot tomato sauce,1.5,80,1,0,19,,,,,,,,,,,,,,,,,
teaspoon of carne asada seasoning,0.04,2,0,0,0,,,,,,,,,,,,,,,,,
package whipped cream topping,2.5,120,0,12,6,,,,,,,,,,,,,,,,,
medium of ripe bananas,0.25,105,1.3,0.4,27,,,,,,,,,,,,,,,,,
cup of toasted and chopped almonds,3.5,828,21,76,16,,,,,,,,,,,,,,,,,
of pickled ginger slices,0.05,2,0,0,0.4,,,,,,,,,,,,,,,,,
cup of melted margarine or butter,0.5,821,0,92,0,,,,,,,,,,,,,,,,,
cup of green garlic,0.5,28,1.8,0.2,5.7,,,,,,,,,,,,,,,,,
of iceberg lettuce leaves,0.02,2,0.2,0,0.3,,,,,,,,,,,,,,,,,
teaspoon of salt and pepper to taste,0.01,0,0,0,0,,,,,,,,,,,,,,,,,
packages instant chicken gravy mix,0.5,80,2,0,16,,,,,,,,,,,,,,,,,
pound of shredded part-skim mozzarella cheese,3.5,1080,72,72,0 carbs,,,,,,,,,,,,,,,,,
package simply potatoes mashed potatoes,2.5,140,2,2.5,28,,,,,,,,,,,,,,,,,
packages bacon,3,860,36,80,0,,,,,,,,,,,,,,,,,
of caramel candies,0.1,24,0,1,5,,,,,,,,,,,,,,,,,
cup of taco seasoning mix,0.5,20,1,0,4,,,,,,,,,,,,,,,,,
medium of red apple,0.5,95,0.3,0.2,25,,,,,,,,,,,,,,,,,
fluid ounce sweetened lime juice,0.05,10,0,0,3,,,,,,,,,,,,,,,,,
cup of long grain white rice,0.25,205,4,0.4,44,,,,,,,,,,,,,,,,,
ounce of dried chipotle chile pepper,0.25,22,1,0,5,,,,,,,,,,,,,,,,,
can refried beans,1.5,360,16,9,42,,,,,,,,,,,,,,,,,
pound of sashimi-grade salmon,14.99,528,56,28,0,,,,,,,,,,,,,,,,,
cup of grapefruit juice,0.5,112,0.6,0.2,28.2,,,,,,,,,,,,,,,,,
of bone-in standing rib roast,11.99,745,72,60,0,,,,,,,,,,,,,,,,,
tablespoon of minced pickled jalapeno pepper,0.06,2,0,0,0,,,,,,,,,,,,,,,,,
medium of cucumbers - peeled,,17,0.2,0.5,1,,,,,,,,,,,,,,,,,
tablespoon of asian chile paste,0.08,10,0,0,2,,,,,,,,,,,,,,,,,
pinch of dried thyme,0.02,0,0,0,0,,,,,,,,,,,,,,,,,
cup of whole roasted cashews,0.5,163,5,14,9,,,,,,,,,,,,,,,,,
pounds of whole leg of lamb,7,576,52,40,0,,,,,,,,,,,,,,,,,
cup of pecans,2.5,718,8,76,13,,,,,,,,,,,,,,,,,
cup of strawberries,0.5,49,0.7,0.3,11.7,,,,,,,,,,,,,,,,,
cup of chopped leftover honey-baked,0.5,224,3,11,28,,,,,,,,,,,,,,,,,
teaspoon of water as needed,0,0,0,0,0,,,,,,,,,,,,,,,,,
cup of carapelli extra virgin olive oil,7.99,1920,0,216,0,,,,,,,,,,,,,,,,,
slices of jicama,0.1,5,0,0,1,,,,,,,,,,,,,,,,,
cup of uncooked regular long-grain white rice,0.2,205,4,0,45,,,,,,,,,,,,,,,,,
can libby's 100% pure pumpkin,2.5,80,4,0,20,,,,,,,,,,,,,,,,,
can cream of coconut,2.5,860,0,100,0,,,,,,,,,,,,,,,,,
packages unflavored gelatin,0.5,32,6,0,0,,,,,,,,,,,,,,,,,
cup of cubed zucchini,0.2,17,1,0.2,2.4,,,,,,,,,,,,,,,,,
of oil-packed sun-dried tomato,0,0,0,0,,,,,,,,,,,,,,,,,,
teaspoon of light soy sauce,0.02,5,0.3,0.1,0.5,,,,,,,,,,,,,,,,,
tablespoon of coarsely chopped macadamia nuts,0.1,37,1,4,1,,,,,,,,,,,,,,,,,
cup of dark mexican beer,0.5,153,0.9,0,12.7,,,,,,,,,,,,,,,,,
of whole clove,0.01,1,0.1,0,0.2,,,,,,,,,,,,,,,,,
pounds of bone-in chicken parts,4,576,48,36,0,,,,,,,,,,,,,,,,,
pound of mild pork sausage,3,864,36,72,0,,,,,,,,,,,,,,,,,
ounces of penne pasta,0.03,25,0.5,0.2,5,,,,,,,,,,,,,,,,,
tablespoon of freshly grated lemon zest,0.05,1,0,0,0,,,,,,,,,,,,,,,,,
cup of dried small red beans,0.5,686,25,1,127,,,,,,,,,,,,,,,,,
cans white meat chicken,1.5,180,17,4,0,,,,,,,,,,,,,,,,,
of olive oil to drizzle,0.05,119,0,14,0,,,,,,,,,,,,,,,,,
of beef tongues,2,140,20,8,0,,,,,,,,,,,,,,,,,
slices of whole wheat bread,0.15,69,3,1,13,,,,,,,,,,,,,,,,,
tablespoon of rubbed sage,0.03,4,0.1,0.1,0.8,,,,,,,,,,,,,,,,,
of beef chuck roast,1.19,180,20,11,0,,,,,,,,,,,,,,,,,
cup of sliced carrot,0.25,25,0.5,0.2,5.9,,,,,,,,,,,,,,,,,
pounds of boneless beef chuck roast,3.5,590,48,42,0,,,,,,,,,,,,,,,,,
cup of fine dry bread crumbs,0.5,114,2.5,0.5,22,,,,,,,,,,,,,,,,,
cup of pitted medjool dates,0.5,282,3,0,75,,,,,,,,,,,,,,,,,
cup of maple syrup sweetened with splenda brand sweetener,0.5,213,0,0,54,,,,,,,,,,,,,,,,,
medium of yams,0.5,180,3,0,41,,,,,,,,,,,,,,,,,
teaspoon of sweet chili sauce,0.02,4,0,0,1,,,,,,,,,,,,,,,,,
tablespoon of flaky sea salt,0.03,0,0,0,0,,,,,,,,,,,,,,,,,
cans turkey chili with beans,2.5,240,16,5,28,,,,,,,,,,,,,,,,,
cup of refrigerated mashed potatoes,0.5,150,3,3,28,,,,,,,,,,,,,,,,,
ounces of candied pineapple slices,0.15,24,0,0,6,,,,,,,,,,,,,,,,,
cup of steak sauce,0.5,60,0,0,12,,,,,,,,,,,,,,,,,
tablespoon of ijon mustard,0.05,3,0,0,0.7,,,,,,,,,,,,,,,,,
ounces of ground lamb,1.5,222,16,17,0,,,,,,,,,,,,,,,,,
of ripe plantain,0.5,121,1,0.3,30,,,,,,,,,,,,,,,,,
cup of grated parmesan cheese,2.5,431,34,28,4,,,,,,,,,,,,,,,,,
bottle honey barbecue sauce,3,600,0,0,150,,,,,,,,,,,,,,,,,
package gingersnap cookies,3,810,8,36,104,,,,,,,,,,,,,,,,,
of shrimp,0.5,24,4,0.3,0,,,,,,,,,,,,,,,,,
cup of light alfredo sauce,0.5,130,4,7,6,,,,,,,,,,,,,,,,,
cup of chopped honeycrisp apple,0.5,81,0.3,0.2,21.4,,,,,,,,,,,,,,,,,
of dried ancho chiles,0.5,20,1,0,4,,,,,,,,,,,,,,,,,
pounds of celery,1,36,1,0,8,,,,,,,,,,,,,,,,,
heads of broccoli with long stems,1,45,4,0,9,,,,,,,,,,,,,,,,,
tablespoon of chili paste,0.03,10,0,0,2,,,,,,,,,,,,,,,,,
of prepared pie crust,2.5,864,8,48,96,,,,,,,,,,,,,,,,,
tablespoon of plain nonfat yogurt,0.03,8,0.3,0.1,0.8,,,,,,,,,,,,,,,,,
cup of shredded monterey jack cheese for the top,0.5,220,14,16,0,,,,,,,,,,,,,,,,,
grams of waxy potatoes,0.1,77,2,0,17,,,,,,,,,,,,,,,,,
pound of chicken legs,2.5,554,28,33,0,,,,,,,,,,,,,,,,,
teaspoon of dried fenugreek leaves,0.02,2,0.1,0.1,0.3,,,,,,,,,,,,,,,,,
cup of steak seasoning,0.5,0,0,0,0,,,,,,,,,,,,,,,,,
pound of thinly sliced pork loin,5,521,53,13,0,,,,,,,,,,,,,,,,,
cup of vegetable broth or stock,0.5,15,0,0,3,,,,,,,,,,,,,,,,,
of whole,0.25,149,8,8,12,,,,,,,,,,,,,,,,,
,,,,,,,,,,,,,,,,,,,,,,
whole egg,0.1,72,6,5,0,,,,,,,,,,,,,,,,,
,,,,,,,,,,,,,,,,,,,,,,
whole wheat flour,0.25,455,13,2,96,,,,,,,,,,,,,,,,,
,,,,,,,,,,,,,,,,,,,,,,
whole grain rice,0.2,100,,,,,,,,,,,,,,,,,,,,
teaspoon of beef bouillon granules,0.03,5,0,0,1,,,,,,,,,,,,,,,,,
ounces of hot pepper sauce,0.03,4,0,0,1,,,,,,,,,,,,,,,,,
slices of potato bread,0.25,80,2,1,16,,,,,,,,,,,,,,,,,
tablespoon of drained capers,0.1,5,0.2,0.1,0.7,,,,,,,,,,,,,,,,,
large,0.15,78,6,5,0.4,,,,,,,,,,,,,,,,,
,,,,,,,,,,,,,,,,,,,,,,
large banana,0.25,121,1.3,0.4,31,,,,,,,,,,,,,,,,,
,,,,,,,,,,,,,,,,,,,,,,
large potato,0.5,162,4,0.2,37,,,,,,,,,,,,,,,,,
package three-cheese tortellini,2,180,8,5,25,,,,,,,,,,,,,,,,,
tablespoon of guacamole,0.13,14,0.2,1.3,0.6,,,,,,,,,,,,,,,,,
can pineapple chunks in juice,2,198,1,0,49,,,,,,,,,,,,,,,,,
of chayote squash - peeled,0.5,17,0.4,0.1,3.4,,,,,,,,,,,,,,,,,
container blueberry-flavored yogurt,1.5,150,6,3,25,,,,,,,,,,,,,,,,,
tablespoon of yellow miso paste,0.1,10,0.5,0.5,1.5,,,,,,,,,,,,,,,,,
cup of oyster mushrooms,0.5,22,2,0,3,,,,,,,,,,,,,,,,,
of fresh grape leaves,0,0,0,0,,,,,,,,,,,,,,,,,,
of half pint canning jars with lids and rings,2.5,0,0,0,0,,,,,,,,,,,,,,,,,
tablespoon of green hot pepper sauce,0.03,5,0,0,1,,,,,,,,,,,,,,,,,
pound of dry great northern beans,1.5,1092,59,1,192,,,,,,,,,,,,,,,,,
cup of fresh grapefruit juice,0.5,82,0.6,0.2,21,,,,,,,,,,,,,,,,,
cup of land o lakes butter with olive oil and sea salt,0.5,821,1,91,0,,,,,,,,,,,,,,,,,
of whole egg,0.2,72,6,5,0.4,,,,,,,,,,,,,,,,,
ounces of whole wheat egg noodles,0.04,22,1,0.2,4,,,,,,,,,,,,,,,,,
cup of greek black olives,0.5,70,0.8,6.5,1.5,,,,,,,,,,,,,,,,,
drops of yellow food coloring,0,0,0,,,,,,,,,,,,,,,,,,,
pound of crumbled queso fresco,2.5,564,24,44,0,,,,,,,,,,,,,,,,,
cup of pearl  couscous,0.5,176,5,0.5,36,,,,,,,,,,,,,,,,,
teaspoon of dried rosemary,0.03,0,0,0,0,,,,,,,,,,,,,,,,,
cup of crushed san marzano tomatoes,0.5,42,1,0,9,,,,,,,,,,,,,,,,,
tablespoon of finely minced red onion,0.05,4,0.1,0,0.9,,,,,,,,,,,,,,,,,
cup of ginger ale,0,0,0,28,,,,,,,,,,,,,,,,,,
tablespoon of minced tomato,0.03,5,0.2,0.1,1.2,,,,,,,,,,,,,,,,,
cup of broccoli florets,0.5,31,2.6,0.3,6.6,,,,,,,,,,,,,,,,,
ounces of uncooked bean threads,0.25,90,6,0,18,,,,,,,,,,,,,,,,,
cup of oatmeal,0.3,166,5,3,27,,,,,,,,,,,,,,,,,
teaspoon of tamarind paste,0.03,4,0,0,1,,,,,,,,,,,,,,,,,
of salt and freshly ground pepper to taste,,,,,,,,,,,,,,,,,,,,,,
cup of julienned  carrots,0.5,25,0.5,0.2,5.7,,,,,,,,,,,,,,,,,
cup of diced potatoes,0.5,110,2,0,25,,,,,,,,,,,,,,,,,
teaspoon of rum extract,0.1,0,0,0,0,,,,,,,,,,,,,,,,,
pound of walnut halves,7.99,828,24,81,13,,,,,,,,,,,,,,,,,
ounces of cream cheese at room temperature,0.17,50,1,5,0.5,,,,,,,,,,,,,,,,,
cup of nonfat vanilla greek yogurt,0.5,130,17,0,17,,,,,,,,,,,,,,,,,
ounces of marinara sauce,0.04,8,0.2,0.3,1.3,,,,,,,,,,,,,,,,,
cup of diced yellow potatoes,0.5,103,2,0,23,,,,,,,,,,,,,,,,,
teaspoon of ground celery seed,0.03,3,0.1,0.2,0.6,,,,,,,,,,,,,,,,,
large of egg yolks,0.05,17,1.5,4.5,0.3,,,,,,,,,,,,,,,,,
can whole peeled tomatoes,2,140,5,0,25,,,,,,,,,,,,,,,,,
slices of brioche,0.2,91,2,4,11,,,,,,,,,,,,,,,,,
cup of minced onion,0.25,44,1,0,10,,,,,,,,,,,,,,,,,
tablespoon of heavy whipping cream,0.05,51,0.5,5.4,0.5,,,,,,,,,,,,,,,,,
pinches of red pepper flakes,0.01,0,0,0,0,,,,,,,,,,,,,,,,,
ounces of uncooked ziti pasta,0.03,28,1,0,6,,,,,,,,,,,,,,,,,
pound of uncooked shrimp,7,576,88,8,0,,,,,,,,,,,,,,,,,
tablespoon of unflavored gelatin,0.05,8,2,0,0,,,,,,,,,,,,,,,,,
cup of finely shredded zucchini,0.25,17,1,0,3,,,,,,,,,,,,,,,,,
pound of cream cheese,2.5,828,32,88,16,,,,,,,,,,,,,,,,,
cup of cooked chicken,0.5,165,26,4,0,,,,,,,,,,,,,,,,,
of very ripe bananas,0,105,1.3,0.4,27,,,,,,,,,,,,,,,,,
teaspoon of dry milk powder,0.02,11,1,0.5,1,,,,,,,,,,,,,,,,,
cup of lightly packed light brown sugar,0.5,774,0,0,198,,,,,,,,,,,,,,,,,
teaspoon of baking powder,0.01,0,0,0,0,,,,,,,,,,,,,,,,,
of assorted crackers or tortilla chips,0.5,150,2,7,18,,,,,,,,,,,,,,,,,
cup of uncooked white rice,0.2,205,4.3,0.4,45,,,,,,,,,,,,,,,,,
fluid ounce brine from olive jar,0.1,8,0,0,0,,,,,,,,,,,,,,,,,
pinch of chili powder,0.01,1,0,0,0,,,,,,,,,,,,,,,,,
cup of cointreau or other orange liqueur,8,810,0,0,0,,,,,,,,,,,,,,,,,
tablespoon of cacao nibs,0.08,12,0.7,0.7,1.2,,,,,,,,,,,,,,,,,
of cinnamon stick,0.1,6,0,0,2,,,,,,,,,,,,,,,,,
cup of mazola vegetable plus! oil,0.5,120,0,14,0,,,,,,,,,,,,,,,,,
cup of macadamia nuts,7.99,718,8,76,16,,,,,,,,,,,,,,,,,
cup of shredded cooked chicken or turkey,0.5,126,24,4,0,,,,,,,,,,,,,,,,,
package gummy worms candy,0.5,150,0,4,33,,,,,,,,,,,,,,,,,
cans mandarin oranges,1,60,0,0,14,,,,,,,,,,,,,,,,,
of metal skewers,0,0,0,0,0,,,,,,,,,,,,,,,,,
quarts of orange juice,3.5,500,12,0,40,,,,,,,,,,,,,,,,,
cup of mild enchilada sauce,0.5,80,2,3,12,,,,,,,,,,,,,,,,,
teaspoon of italian herb seasoning blend,0.05,2,0,0,0.5,,,,,,,,,,,,,,,,,
cup of cubed white bread,0.2,79,2,0.5,16,,,,,,,,,,,,,,,,,
container plain yogurt,1,150,11,5,12,,,,,,,,,,,,,,,,,
packages corn tortillas,0.5,120,2,3,24,,,,,,,,,,,,,,,,,
cup of peeled and chopped carrot,0.25,50,1,0,12,,,,,,,,,,,,,,,,,
cup of diced bell peppers,0.5,20,0.5,0.2,4.3,,,,,,,,,,,,,,,,,
cup of diced bacon,0.5,519,16,44,0,,,,,,,,,,,,,,,,,
tablespoon of chopped fresh cilantro,0.05,1,0.1,0.1,0.2,,,,,,,,,,,,,,,,,
fluid ounces light rum,0.1,64,0,0,0,,,,,,,,,,,,,,,,,
of 5  storage containers,0,0,0,0,,,,,,,,,,,,,,,,,,
pounds of lamb shoulder arm chops,5.5,643,60,44,0,,,,,,,,,,,,,,,,,
package chicken-flavored ramen noodles,0.5,480,12,16,56,,,,,,,,,,,,,,,,,
package powdered sugar,1.5,864,0,0,216,,,,,,,,,,,,,,,,,
cup of thinly sliced onion,0.25,44,1,0,10,,,,,,,,,,,,,,,,,
teaspoon of vanilla powder,0.03,4,0,0,1,,,,,,,,,,,,,,,,,
of vegetable oil cooking spray,0,0,0,0,,,,,,,,,,,,,,,,,,
jar hot fudge sauce,4,825,8,33,85,,,,,,,,,,,,,,,,,
large of apples - peeled,0.5,95,0.3,0.2,25,,,,,,,,,,,,,,,,,
cup of crushed pineapple with syrup,,,,,,,,,,,,,,,,,,,,,,
,,,,,,,,,,,,,,,,,,,,,,
1 cup,0.5,83,0.5,0,21,,,,,,,,,,,,,,,,,
cup of agave syrup,0.5,210,0,0,56,,,,,,,,,,,,,,,,,
of rack of lamb,13,637,56,43,0,,,,,,,,,,,,,,,,,
cup of small pretzels,0.5,110,2,0.5,23,,,,,,,,,,,,,,,,,
cup of thinly sliced green onions,0.1,32,1.3,0.2,6.9,,,,,,,,,,,,,,,,,
cup chopped onion,0.25,44,1,0,10,,,,,,,,,,,,,,,,,
tablespoon of balsamic glaze,0.05,10,0,0,2,,,,,,,,,,,,,,,,,
ounces of dry rice stick noodles,0.05,28,0.8,0.2,6,,,,,,,,,,,,,,,,,
fluid ounce red food coloring,0.1,0,0,0,0,,,,,,,,,,,,,,,,,
teaspoon of mushroom seasoning,0.05,0,0,0,0,,,,,,,,,,,,,,,,,
medium of baking potatoes,0.5,110,3,0,25,,,,,,,,,,,,,,,,,
teaspoon of extra-virgin olive oil,0.04,40,0,5,0,,,,,,,,,,,,,,,,,
ounces of pork fat,0.2,45,1,5,0,,,,,,,,,,,,,,,,,
teaspoon of celery seed,0.03,2,0.1,0.1,0.4,,,,,,,,,,,,,,,,,
tablespoon of chia seeds,0.06,28,1.5,2,2.5,,,,,,,,,,,,,,,,,
of frozen unbaked pie crust,2.5,810,11,48,72,,,,,,,,,,,,,,,,,
cup of diced tomato,0.5,22,1,0,5,,,,,,,,,,,,,,,,,
tablespoon of asian  sesame oil,0.18,120,0,14,0,,,,,,,,,,,,,,,,,
cup of 60% cacao bittersweet chocolate morsels,0.5,220,3,14,24,,,,,,,,,,,,,,,,,
can marinara sauce,0.5,70,2,3,10,,,,,,,,,,,,,,,,,
pound of cubed ham steak,3.5,590,44,29,0,,,,,,,,,,,,,,,,,
pound of shiitake mushrooms,5,176,10,0.5,38,,,,,,,,,,,,,,,,,
fluid ounces beer,1.5,153,1.4,0,12.7,,,,,,,,,,,,,,,,,
cup of skim or 1% milk,0.25,86,8,0.5,12,,,,,,,,,,,,,,,,,
cup of garlic salt or to taste,0.5,0,0,0,0,,,,,,,,,,,,,,,,,
package chocolate frosting,2.5,860,0,40,100,,,,,,,,,,,,,,,,,
cup of flaked coconut,0.5,283,3,27,12,,,,,,,,,,,,,,,,,
package frozen chopped onions,2.5,80,2,0,18,,,,,,,,,,,,,,,,,
pound of uncooked green lentils,1,716,39,4,116,,,,,,,,,,,,,,,,,
cup of canola or other vegetable oil,0.5,1920,0,224,0,,,,,,,,,,,,,,,,,
package bow-tie pasta,1,200,7,1,40,,,,,,,,,,,,,,,,,
pounds of shredded pepper jack cheese,4,912,72,72,0,,,,,,,,,,,,,,,,,
tablespoon of carne asada seasoning,0.1,10,0,0,2,,,,,,,,,,,,,,,,,
of kosher salt and freshly ground pepper,0,0,0,,,,,,,,,,,,,,,,,,,
cup of finely chopped mushrooms,0.5,15,1,0,2,,,,,,,,,,,,,,,,,
pound of bone-in pork loin roast,4,541,57,28,0,,,,,,,,,,,,,,,,,
teaspoon of dried red chili flakes,0.05,2,0,0,0.5,,,,,,,,,,,,,,,,,
of large chayote squash - peeled,0.5,47,1.3,0.2,11.3,,,,,,,,,,,,,,,,,
of large egg,0.17,72,6,5,0.5,,,,,,,,,,,,,,,,,
pound of sea scallops,10,210,24,2,0,,,,,,,,,,,,,,,,,
cup of dry garbanzo beans,0.5,212,14.5,3.5,36.5,,,,,,,,,,,,,,,,,
cup of cherry juice,0.5,112,0.5,0,28,,,,,,,,,,,,,,,,,
boxes frozen potato pierogies,2.5,210,5,8,30,,,,,,,,,,,,,,,,,
tablespoon of reduced-sodium soy sauce,0.03,8,0.9,0.2,0.9,,,,,,,,,,,,,,,,,
tablespoon of cinnamon,0.03,6,0.1,0.1,1.9,,,,,,,,,,,,,,,,,
cup of diced fire-roasted red peppers,0.5,24,0.7,0.2,4.7,,,,,,,,,,,,,,,,,
of roma  tomatoes - halved,0.25,12,0.5,0.2,2.5,,,,,,,,,,,,,,,,,
can kidney beans - rinsed,0.5,218,13,0.5,39,,,,,,,,,,,,,,,,,
large of celery rib,0.1,6,0.5,0,1.3,,,,,,,,,,,,,,,,,
dash of worcestershire sauce,0.01,0,0,0,0,,,,,,,,,,,,,,,,,
large of russet potatoes - peeled,0.5,161,4,0,36,,,,,,,,,,,,,,,,,
cup of apple slices,0.5,52,0.3,0.2,13.8,,,,,,,,,,,,,,,,,
package cinnamon baking chips,2.5,240,2,8,48,,,,,,,,,,,,,,,,,
tablespoon of hon mirin,0.03,10,0,0,2,,,,,,,,,,,,,,,,,
tablespoon of dried currants,0.06,24,0.3,0.1,5.9,,,,,,,,,,,,,,,,,
fluid ounce rum,0.25,97,0,0,0,,,,,,,,,,,,,,,,,
package refrigerated crescent roll dough,2.5,880,16,32,96,,,,,,,,,,,,,,,,,
cup of quick-cooking steel-cut oats,0.5,150,5,2.5,27,,,,,,,,,,,,,,,,,
teaspoon of wasabi paste,0.1,2,0,0,0,,,,,,,,,,,,,,,,,
package mexican-style chorizo,4.99,860,40,72,2,,,,,,,,,,,,,,,,,
of packed cilantro leaves,0.1,1,0.1,0,0.2,,,,,,,,,,,,,,,,,
cup of chopped slivered almonds,2.5,828,21,76,20,,,,,,,,,,,,,,,,,
slices of cheddar or colby cheese,0.1,113,7,9,0,,,,,,,,,,,,,,,,,
cup of all-purpose flour for dredging,0.5,455,10,1,93,,,,,,,,,,,,,,,,,
envelope whipped topping mix,0.5,60,0,0,15,,,,,,,,,,,,,,,,,
cup of fresh green beans,0.25,44,2,0,10,,,,,,,,,,,,,,,,,
tub of duncan hines creamy home-style vanilla icing,3.99,860,0,36,144,,,,,,,,,,,,,,,,,
of reynolds kitchens parchment paper with smartgrid,0.5,0,0,0,0,,,,,,,,,,,,,,,,,
cup of apples - peeled,0.5,95,0.5,0.3,25,,,,,,,,,,,,,,,,,
teaspoon of dried minced shallot,0.04,2,0,0,0.5,,,,,,,,,,,,,,,,,
of whole jalapeno peppers with stems,0.25,4,0.2,0.1,0.7,,,,,,,,,,,,,,,,,
pounds of goat meat,7,544,48,36,0,,,,,,,,,,,,,,,,,
cup of frozen hash brown potatoes with peppers and onion,0.5,140,2,6,20,,,,,,,,,,,,,,,,,
cup of pan drippings from prime rib,0,0,0,0,,,,,,,,,,,,,,,,,,
pounds of leg of lamb,6,590,44,40,0,,,,,,,,,,,,,,,,,
cans fully cooked luncheon meat,1.5,160,14,9,0,,,,,,,,,,,,,,,,,
teaspoon of white vinegar,0.01,0,0,0,0,,,,,,,,,,,,,,,,,
cup of seeded and diced jalapeno peppers,0.5,4,0.2,0.1,0.9,,,,,,,,,,,,,,,,,
of nonstick vegetable oil cooking spray,0.01,0,0,0,0,,,,,,,,,,,,,,,,,
cup of guava juice,0.5,118,0.3,0.2,29.2,,,,,,,,,,,,,,,,,
teaspoon of dried celery leaves,0.03,0,0,0,0,,,,,,,,,,,,,,,,,
cup of chopped water chestnuts,0.5,28,0.6,0.1,6.2,,,,,,,,,,,,,,,,,
pound of bacon,4,1164,48,104,0,,,,,,,,,,,,,,,,,
of slices of pork tenderloin,0.75,140,22,5,0,,,,,,,,,,,,,,,,,
stick of mozzarella string cheese,0.5,80,6,6,0,,,,,,,,,,,,,,,,,
cup of mini semisweet chocolate chips,0.5,204,2,12,24,,,,,,,,,,,,,,,,,
teaspoon of cure,0.01,0,0,0,0,,,,,,,,,,,,,,,,,
teaspoon of dried chives for garnish,0.05,1,0,0,0,,,,,,,,,,,,,,,,,
fluid ounces club soda,0.06,0,0,0,0,,,,,,,,,,,,,,,,,
of baking spray with flour,0.5,0,0,0,0,,,,,,,,,,,,,,,,,
cup of shredded reduced-fat sharp cheddar cheese,0.5,114,7,6,1,,,,,,,,,,,,,,,,,
bottle lemon-lime flavored carbonated beverage,1,140,0,0,38,,,,,,,,,,,,,,,,,
pounds of shredded extra-sharp cheddar cheese,5,912,72,72,0,,,,,,,,,,,,,,,,,
teaspoon of ground black pepper to taste,0.01,1,0,0,0,,,,,,,,,,,,,,,,,
large of garlic clove,0.02,4,0.2,0,1,,,,,,,,,,,,,,,,,
cup of shredded carrots,0.25,50,1,0,11,,,,,,,,,,,,,,,,,
gallon of coffee ice cream,15,6240,120,480,600,,,,,,,,,,,,,,,,,
of frozen deep-dish pie crust,3.5,810,8,36,86,,,,,,,,,,,,,,,,,
tablespoon of chopped fresh sage,0.05,2,0.1,0.1,0.2,,,,,,,,,,,,,,,,,
pounds of yukon gold potatoes,1.5,576,16,0,132,,,,,,,,,,,,,,,,,
pound of dry green split peas,1,716,39,1,134,,,,,,,,,,,,,,,,,
cup of cream,0.5,204,2,20,2,,,,,,,,,,,,,,,,,
teaspoon of melt organic buttery spread,0.03,10,0,1,0,,,,,,,,,,,,,,,,,
of 3 cup hickory chips,0.75,540,0,0,0,,,,,,,,,,,,,,,,,
package vegetarian sausage links,4,120,7,4,8,,,,,,,,,,,,,,,,,
cup of chocolate liqueur,0.5,252,0,0,16,,,,,,,,,,,,,,,,,
cup of shredded carrot,0.25,25,0.5,0.2,5.9,,,,,,,,,,,,,,,,,
cup of halved green grapes,0.5,104,1,0.3,27,,,,,,,,,,,,,,,,,
can diced green chile peppers,2,20,0.5,0.2,4.3,,,,,,,,,,,,,,,,,
pinch of vanilla extract,0.01,0,0,0,0,,,,,,,,,,,,,,,,,
cup of chicken stock,0,0,2,0,0,,,,,,,,,,,,,,,,,
of whole black peppercorns,0.02,4,0.2,0.1,0.9,,,,,,,,,,,,,,,,,
of canning jar,0,0,0,,,,,,,,,,,,,,,,,,,
ounces of chocolate chips,0.25,70,1,4,8,,,,,,,,,,,,,,,,,
can homemade chicken broth or low-sodium canned broth,0.5,24,2,0,4,,,,,,,,,,,,,,,,,
,,,,,,,,,,,,,,,,,,,,,,
low-sodium canned broth,0.5,10,1,0,1,,,,,,,,,,,,,,,,,
ounces of roquefort cheese,0.5,75,5,6,0,,,,,,,,,,,,,,,,,
ounces of crumbled fresh french breadcrumbs,0.1,24,1,0.5,4,,,,,,,,,,,,,,,,,
cup of water*,0,0,0,0,0,,,,,,,,,,,,,,,,,
tablespoon of prepared jalapeno pepper jelly,0.1,20,0,0,5,,,,,,,,,,,,,,,,,
cup of finely chopped shallots,0.5,28,0.3,0.1,6.4,,,,,,,,,,,,,,,,,
large of minced onion,0.5,32,1,0,7,,,,,,,,,,,,,,,,,
